  1 2016-10-18 22:21:38.397279     10.0.0.4 -> 10.0.0.1     TCP 74 targus-getdata1 > 38323 [SYN, ACK] Seq=0 Ack=1 Win=28960 Len=0 MSS=1460 SACK_PERM=1 TSval=121975069 TSecr=121975047 WS=512
  2 2016-10-18 22:21:38.397347     10.0.0.1 -> 10.0.0.4     TCP 66 38323 > targus-getdata1 [ACK] Seq=1 Ack=1 Win=58 Len=0 TSval=121975089 TSecr=121975069
  3 2016-10-18 22:21:38.397905     10.0.0.1 -> 10.0.0.4     TCP 103 38323 > targus-getdata1 [PSH, ACK] Seq=1 Ack=1 Win=58 Len=37 TSval=121975090 TSecr=121975069
  4 2016-10-18 22:21:38.438387     10.0.0.4 -> 10.0.0.1     TCP 66 targus-getdata1 > 38323 [ACK] Seq=1 Ack=38 Win=29184 Len=0 TSval=121975110 TSecr=121975090
  5 2016-10-18 22:21:38.438389     10.0.0.4 -> 10.0.0.1     TCP 67 targus-getdata1 > 38323 [PSH, ACK] Seq=1 Ack=38 Win=29184 Len=1 TSval=121975110 TSecr=121975090
  6 2016-10-18 22:21:38.438467     10.0.0.1 -> 10.0.0.4     TCP 66 38323 > targus-getdata1 [ACK] Seq=38 Ack=2 Win=58 Len=0 TSval=121975130 TSecr=121975110
  7 2016-10-18 22:21:38.439032     10.0.0.1 -> 10.0.0.4     TCP 70 38323 > targus-getdata1 [PSH, ACK] Seq=38 Ack=2 Win=58 Len=4 TSval=121975131 TSecr=121975110
  8 2016-10-18 22:21:38.518871     10.0.0.4 -> 10.0.0.1     TCP 66 targus-getdata1 > 38323 [ACK] Seq=2 Ack=42 Win=29184 Len=0 TSval=121975191 TSecr=121975131
  9 2016-10-18 22:21:38.518943     10.0.0.1 -> 10.0.0.4     TCP 123 38323 > targus-getdata1 [PSH, ACK] Seq=42 Ack=2 Win=58 Len=57 TSval=121975211 TSecr=121975191
 10 2016-10-18 22:21:38.559496     10.0.0.4 -> 10.0.0.1     TCP 66 targus-getdata1 > 38323 [ACK] Seq=2 Ack=99 Win=29184 Len=0 TSval=121975231 TSecr=121975211
 11 2016-10-18 22:21:38.559589     10.0.0.4 -> 10.0.0.1     TCP 67 targus-getdata1 > 38323 [PSH, ACK] Seq=2 Ack=99 Win=29184 Len=1 TSval=121975231 TSecr=121975211
 12 2016-10-18 22:21:38.559800     10.0.0.1 -> 10.0.0.4     TCP 74 38324 > targus-getdata1 [SYN] Seq=0 Win=29200 Len=0 MSS=1460 SACK_PERM=1 TSval=121975252 TSecr=0 WS=512
 13 2016-10-18 22:21:38.598733     10.0.0.1 -> 10.0.0.4     TCP 66 38323 > targus-getdata1 [ACK] Seq=99 Ack=3 Win=58 Len=0 TSval=121975291 TSecr=121975231
 14 2016-10-18 22:21:38.600287     10.0.0.4 -> 10.0.0.1     TCP 74 targus-getdata1 > 38324 [SYN, ACK] Seq=0 Ack=1 Win=28960 Len=0 MSS=1460 SACK_PERM=1 TSval=121975272 TSecr=121975252 WS=512
 15 2016-10-18 22:21:38.600369     10.0.0.1 -> 10.0.0.4     TCP 66 38324 > targus-getdata1 [ACK] Seq=1 Ack=1 Win=29696 Len=0 TSval=121975292 TSecr=121975272
 16 2016-10-18 22:21:38.600422     10.0.0.1 -> 10.0.0.4     TCP 103 38324 > targus-getdata1 [PSH, ACK] Seq=1 Ack=1 Win=29696 Len=37 TSval=121975292 TSecr=121975272
 17 2016-10-18 22:21:38.640904     10.0.0.4 -> 10.0.0.1     TCP 66 targus-getdata1 > 38324 [ACK] Seq=1 Ack=38 Win=29184 Len=0 TSval=121975313 TSecr=121975292
 18 2016-10-18 22:21:38.645120     10.0.0.4 -> 10.0.0.1     TCP 67 targus-getdata1 > 38323 [PSH, ACK] Seq=3 Ack=99 Win=29184 Len=1 TSval=121975317 TSecr=121975291
 19 2016-10-18 22:21:38.645180     10.0.0.1 -> 10.0.0.4     TCP 66 38323 > targus-getdata1 [ACK] Seq=99 Ack=4 Win=58 Len=0 TSval=121975337 TSecr=121975317
 20 2016-10-18 22:21:38.685606     10.0.0.4 -> 10.0.0.1     TCP 67 targus-getdata1 > 38323 [PSH, ACK] Seq=4 Ack=99 Win=29184 Len=1 TSval=121975357 TSecr=121975337[Malformed Packet]
 21 2016-10-18 22:21:38.685653     10.0.0.1 -> 10.0.0.4     TCP 66 38323 > targus-getdata1 [ACK] Seq=99 Ack=5 Win=58 Len=0 TSval=121975378 TSecr=121975357
 22 2016-10-18 22:21:38.685691     10.0.0.1 -> 10.0.0.4     TCP 1514 38324 > targus-getdata1 [ACK] Seq=38 Ack=1 Win=29696 Len=1448 TSval=121975378 TSecr=121975313
 23 2016-10-18 22:21:38.685721     10.0.0.1 -> 10.0.0.4     TCP 1514 38324 > targus-getdata1 [ACK] Seq=1486 Ack=1 Win=29696 Len=1448 TSval=121975378 TSecr=121975313
 24 2016-10-18 22:21:38.685745     10.0.0.1 -> 10.0.0.4     TCP 1514 38324 > targus-getdata1 [ACK] Seq=2934 Ack=1 Win=29696 Len=1448 TSval=121975378 TSecr=121975313
 25 2016-10-18 22:21:38.685765     10.0.0.1 -> 10.0.0.4     TCP 1514 38324 > targus-getdata1 [ACK] Seq=4382 Ack=1 Win=29696 Len=1448 TSval=121975378 TSecr=121975313
 26 2016-10-18 22:21:38.685784     10.0.0.1 -> 10.0.0.4     TCP 1514 38324 > targus-getdata1 [ACK] Seq=5830 Ack=1 Win=29696 Len=1448 TSval=121975378 TSecr=121975313
 27 2016-10-18 22:21:38.685799     10.0.0.1 -> 10.0.0.4     TCP 1514 38324 > targus-getdata1 [ACK] Seq=7278 Ack=1 Win=29696 Len=1448 TSval=121975378 TSecr=121975313
 28 2016-10-18 22:21:38.685812     10.0.0.1 -> 10.0.0.4     TCP 1514 38324 > targus-getdata1 [ACK] Seq=8726 Ack=1 Win=29696 Len=1448 TSval=121975378 TSecr=121975313
 29 2016-10-18 22:21:38.685833     10.0.0.1 -> 10.0.0.4     TCP 1514 38324 > targus-getdata1 [ACK] Seq=10174 Ack=1 Win=29696 Len=1448 TSval=121975378 TSecr=121975313
 30 2016-10-18 22:21:38.685872     10.0.0.1 -> 10.0.0.4     TCP 1514 38324 > targus-getdata1 [ACK] Seq=11622 Ack=1 Win=29696 Len=1448 TSval=121975378 TSecr=121975313
 31 2016-10-18 22:21:38.685892     10.0.0.1 -> 10.0.0.4     TCP 1514 38324 > targus-getdata1 [ACK] Seq=13070 Ack=1 Win=29696 Len=1448 TSval=121975378 TSecr=121975313
 32 2016-10-18 22:21:38.726128     10.0.0.4 -> 10.0.0.1     TCP 66 targus-getdata1 > 38324 [ACK] Seq=1 Ack=1486 Win=32256 Len=0 TSval=121975398 TSecr=121975378
 33 2016-10-18 22:21:38.726219     10.0.0.1 -> 10.0.0.4     TCP 1514 38324 > targus-getdata1 [PSH, ACK] Seq=14518 Ack=1 Win=29696 Len=1448 TSval=121975418 TSecr=121975398
 34 2016-10-18 22:21:38.726256     10.0.0.1 -> 10.0.0.4     TCP 1514 38324 > targus-getdata1 [ACK] Seq=15966 Ack=1 Win=29696 Len=1448 TSval=121975418 TSecr=121975398
 35 2016-10-18 22:21:38.726561     10.0.0.4 -> 10.0.0.1     TCP 66 targus-getdata1 > 38324 [ACK] Seq=1 Ack=2934 Win=34816 Len=0 TSval=121975398 TSecr=121975378
 36 2016-10-18 22:21:38.726648     10.0.0.1 -> 10.0.0.4     TCP 1514 38324 > targus-getdata1 [ACK] Seq=17414 Ack=1 Win=29696 Len=1448 TSval=121975419 TSecr=121975398
 37 2016-10-18 22:21:38.726662     10.0.0.1 -> 10.0.0.4     TCP 1514 38324 > targus-getdata1 [ACK] Seq=18862 Ack=1 Win=29696 Len=1448 TSval=121975419 TSecr=121975398
 38 2016-10-18 22:21:38.727223     10.0.0.4 -> 10.0.0.1     TCP 66 targus-getdata1 > 38324 [ACK] Seq=1 Ack=4382 Win=37888 Len=0 TSval=121975399 TSecr=121975378
 39 2016-10-18 22:21:38.727295     10.0.0.1 -> 10.0.0.4     TCP 1514 38324 > targus-getdata1 [ACK] Seq=20310 Ack=1 Win=29696 Len=1448 TSval=121975419 TSecr=121975399
 40 2016-10-18 22:21:38.727310     10.0.0.1 -> 10.0.0.4     TCP 1514 38324 > targus-getdata1 [ACK] Seq=21758 Ack=1 Win=29696 Len=1448 TSval=121975419 TSecr=121975399
 41 2016-10-18 22:21:38.728586     10.0.0.4 -> 10.0.0.1     TCP 66 targus-getdata1 > 38324 [ACK] Seq=1 Ack=5830 Win=40960 Len=0 TSval=121975400 TSecr=121975378
 42 2016-10-18 22:21:38.728687     10.0.0.1 -> 10.0.0.4     TCP 1514 38324 > targus-getdata1 [ACK] Seq=23206 Ack=1 Win=29696 Len=1448 TSval=121975421 TSecr=121975400
 43 2016-10-18 22:21:38.728718     10.0.0.1 -> 10.0.0.4     TCP 1514 38324 > targus-getdata1 [ACK] Seq=24654 Ack=1 Win=29696 Len=1448 TSval=121975421 TSecr=121975400
 44 2016-10-18 22:21:38.729756     10.0.0.4 -> 10.0.0.1     TCP 66 targus-getdata1 > 38324 [ACK] Seq=1 Ack=7278 Win=43520 Len=0 TSval=121975402 TSecr=121975378
 45 2016-10-18 22:21:38.729814     10.0.0.1 -> 10.0.0.4     TCP 1514 38324 > targus-getdata1 [ACK] Seq=26102 Ack=1 Win=29696 Len=1448 TSval=121975422 TSecr=121975402
 46 2016-10-18 22:21:38.729825     10.0.0.1 -> 10.0.0.4     TCP 1514 38324 > targus-getdata1 [ACK] Seq=27550 Ack=1 Win=29696 Len=1448 TSval=121975422 TSecr=121975402
 47 2016-10-18 22:21:38.731037     10.0.0.4 -> 10.0.0.1     TCP 66 targus-getdata1 > 38324 [ACK] Seq=1 Ack=8726 Win=46592 Len=0 TSval=121975403 TSecr=121975378
 48 2016-10-18 22:21:38.731100     10.0.0.1 -> 10.0.0.4     TCP 1514 38324 > targus-getdata1 [ACK] Seq=28998 Ack=1 Win=29696 Len=1448 TSval=121975423 TSecr=121975403
 49 2016-10-18 22:21:38.731110     10.0.0.1 -> 10.0.0.4     TCP 1514 38324 > targus-getdata1 [PSH, ACK] Seq=30446 Ack=1 Win=29696 Len=1448 TSval=121975423 TSecr=121975403
 50 2016-10-18 22:21:38.732117     10.0.0.4 -> 10.0.0.1     TCP 66 targus-getdata1 > 38324 [ACK] Seq=1 Ack=10174 Win=49664 Len=0 TSval=121975404 TSecr=121975378
 51 2016-10-18 22:21:38.732173     10.0.0.1 -> 10.0.0.4     TCP 1514 38324 > targus-getdata1 [ACK] Seq=31894 Ack=1 Win=29696 Len=1448 TSval=121975424 TSecr=121975404
 52 2016-10-18 22:21:38.732192     10.0.0.1 -> 10.0.0.4     TCP 1514 38324 > targus-getdata1 [ACK] Seq=33342 Ack=1 Win=29696 Len=1448 TSval=121975424 TSecr=121975404
 53 2016-10-18 22:21:38.733340     10.0.0.4 -> 10.0.0.1     TCP 66 targus-getdata1 > 38324 [ACK] Seq=1 Ack=11622 Win=52224 Len=0 TSval=121975405 TSecr=121975378
 54 2016-10-18 22:21:38.733396     10.0.0.1 -> 10.0.0.4     TCP 1514 38324 > targus-getdata1 [ACK] Seq=34790 Ack=1 Win=29696 Len=1448 TSval=121975425 TSecr=121975405
 55 2016-10-18 22:21:38.733407     10.0.0.1 -> 10.0.0.4     TCP 1514 38324 > targus-getdata1 [ACK] Seq=36238 Ack=1 Win=29696 Len=1448 TSval=121975425 TSecr=121975405
 56 2016-10-18 22:21:38.734649     10.0.0.4 -> 10.0.0.1     TCP 66 targus-getdata1 > 38324 [ACK] Seq=1 Ack=13070 Win=55296 Len=0 TSval=121975406 TSecr=121975378
 57 2016-10-18 22:21:38.734716     10.0.0.1 -> 10.0.0.4     TCP 1514 38324 > targus-getdata1 [ACK] Seq=37686 Ack=1 Win=29696 Len=1448 TSval=121975427 TSecr=121975406
 58 2016-10-18 22:21:38.734726     10.0.0.1 -> 10.0.0.4     TCP 1514 38324 > targus-getdata1 [ACK] Seq=39134 Ack=1 Win=29696 Len=1448 TSval=121975427 TSecr=121975406
 59 2016-10-18 22:21:38.735813     10.0.0.4 -> 10.0.0.1     TCP 66 targus-getdata1 > 38324 [ACK] Seq=1 Ack=14518 Win=58368 Len=0 TSval=121975408 TSecr=121975378
 60 2016-10-18 22:21:38.735870     10.0.0.1 -> 10.0.0.4     TCP 1514 38324 > targus-getdata1 [ACK] Seq=40582 Ack=1 Win=29696 Len=1448 TSval=121975428 TSecr=121975408
 61 2016-10-18 22:21:38.735881     10.0.0.1 -> 10.0.0.4     TCP 1514 38324 > targus-getdata1 [ACK] Seq=42030 Ack=1 Win=29696 Len=1448 TSval=121975428 TSecr=121975408
 62 2016-10-18 22:21:38.766802     10.0.0.4 -> 10.0.0.1     TCP 66 targus-getdata1 > 38324 [ACK] Seq=1 Ack=15966 Win=60928 Len=0 TSval=121975439 TSecr=121975418
 63 2016-10-18 22:21:38.766890     10.0.0.1 -> 10.0.0.4     TCP 1514 38324 > targus-getdata1 [ACK] Seq=43478 Ack=1 Win=29696 Len=1448 TSval=121975459 TSecr=121975439
 64 2016-10-18 22:21:38.766910     10.0.0.1 -> 10.0.0.4     TCP 1514 38324 > targus-getdata1 [ACK] Seq=44926 Ack=1 Win=29696 Len=1448 TSval=121975459 TSecr=121975439
 65 2016-10-18 22:21:38.766960     10.0.0.4 -> 10.0.0.1     TCP 66 targus-getdata1 > 38324 [ACK] Seq=1 Ack=17414 Win=64000 Len=0 TSval=121975439 TSecr=121975418
 66 2016-10-18 22:21:38.767006     10.0.0.1 -> 10.0.0.4     TCP 1514 38324 > targus-getdata1 [PSH, ACK] Seq=46374 Ack=1 Win=29696 Len=1448 TSval=121975459 TSecr=121975439
 67 2016-10-18 22:21:38.767016     10.0.0.1 -> 10.0.0.4     TCP 1514 38324 > targus-getdata1 [ACK] Seq=47822 Ack=1 Win=29696 Len=1448 TSval=121975459 TSecr=121975439
 68 2016-10-18 22:21:38.767880     10.0.0.4 -> 10.0.0.1     TCP 66 targus-getdata1 > 38324 [ACK] Seq=1 Ack=18862 Win=67072 Len=0 TSval=121975440 TSecr=121975419
 69 2016-10-18 22:21:38.767959     10.0.0.1 -> 10.0.0.4     TCP 1514 38324 > targus-getdata1 [ACK] Seq=49270 Ack=1 Win=29696 Len=1448 TSval=121975460 TSecr=121975440
 70 2016-10-18 22:21:38.767977     10.0.0.1 -> 10.0.0.4     TCP 1514 38324 > targus-getdata1 [ACK] Seq=50718 Ack=1 Win=29696 Len=1448 TSval=121975460 TSecr=121975440
 71 2016-10-18 22:21:38.769143     10.0.0.4 -> 10.0.0.1     TCP 66 targus-getdata1 > 38324 [ACK] Seq=1 Ack=20310 Win=69632 Len=0 TSval=121975441 TSecr=121975419
 72 2016-10-18 22:21:38.769205     10.0.0.1 -> 10.0.0.4     TCP 1514 38324 > targus-getdata1 [ACK] Seq=52166 Ack=1 Win=29696 Len=1448 TSval=121975461 TSecr=121975441
 73 2016-10-18 22:21:38.769238     10.0.0.1 -> 10.0.0.4     TCP 1514 38324 > targus-getdata1 [ACK] Seq=53614 Ack=1 Win=29696 Len=1448 TSval=121975461 TSecr=121975441
 74 2016-10-18 22:21:38.770368     10.0.0.4 -> 10.0.0.1     TCP 66 targus-getdata1 > 38324 [ACK] Seq=1 Ack=21758 Win=72704 Len=0 TSval=121975442 TSecr=121975419
 75 2016-10-18 22:21:38.770443     10.0.0.1 -> 10.0.0.4     TCP 1514 38324 > targus-getdata1 [ACK] Seq=55062 Ack=1 Win=29696 Len=1448 TSval=121975462 TSecr=121975442
 76 2016-10-18 22:21:38.770464     10.0.0.1 -> 10.0.0.4     TCP 1514 38324 > targus-getdata1 [PSH, ACK] Seq=56510 Ack=1 Win=29696 Len=1448 TSval=121975462 TSecr=121975442
 77 2016-10-18 22:21:38.771683     10.0.0.4 -> 10.0.0.1     TCP 66 targus-getdata1 > 38324 [ACK] Seq=1 Ack=23206 Win=75776 Len=0 TSval=121975443 TSecr=121975419
 78 2016-10-18 22:21:38.771774     10.0.0.1 -> 10.0.0.4     TCP 1514 38324 > targus-getdata1 [ACK] Seq=57958 Ack=1 Win=29696 Len=1448 TSval=121975464 TSecr=121975443
 79 2016-10-18 22:21:38.771785     10.0.0.1 -> 10.0.0.4     TCP 1514 38324 > targus-getdata1 [ACK] Seq=59406 Ack=1 Win=29696 Len=1448 TSval=121975464 TSecr=121975443
 80 2016-10-18 22:21:38.772856     10.0.0.4 -> 10.0.0.1     TCP 66 targus-getdata1 > 38324 [ACK] Seq=1 Ack=24654 Win=78336 Len=0 TSval=121975445 TSecr=121975421
 81 2016-10-18 22:21:38.772916     10.0.0.1 -> 10.0.0.4     TCP 1514 38324 > targus-getdata1 [ACK] Seq=60854 Ack=1 Win=29696 Len=1448 TSval=121975465 TSecr=121975445
 82 2016-10-18 22:21:38.772927     10.0.0.1 -> 10.0.0.4     TCP 1514 38324 > targus-getdata1 [ACK] Seq=62302 Ack=1 Win=29696 Len=1448 TSval=121975465 TSecr=121975445
 83 2016-10-18 22:21:38.773968     10.0.0.4 -> 10.0.0.1     TCP 66 targus-getdata1 > 38324 [ACK] Seq=1 Ack=26102 Win=81408 Len=0 TSval=121975446 TSecr=121975421
 84 2016-10-18 22:21:38.774026     10.0.0.1 -> 10.0.0.4     TCP 1514 38324 > targus-getdata1 [ACK] Seq=63750 Ack=1 Win=29696 Len=1448 TSval=121975466 TSecr=121975446
 85 2016-10-18 22:21:38.774037     10.0.0.1 -> 10.0.0.4     TCP 1514 38324 > targus-getdata1 [ACK] Seq=65198 Ack=1 Win=29696 Len=1448 TSval=121975466 TSecr=121975446
 86 2016-10-18 22:21:38.775164     10.0.0.4 -> 10.0.0.1     TCP 66 targus-getdata1 > 38324 [ACK] Seq=1 Ack=27550 Win=84480 Len=0 TSval=121975447 TSecr=121975422
 87 2016-10-18 22:21:38.775225     10.0.0.1 -> 10.0.0.4     TCP 1514 38324 > targus-getdata1 [ACK] Seq=66646 Ack=1 Win=29696 Len=1448 TSval=121975467 TSecr=121975447
 88 2016-10-18 22:21:38.775236     10.0.0.1 -> 10.0.0.4     TCP 1514 38324 > targus-getdata1 [ACK] Seq=68094 Ack=1 Win=29696 Len=1448 TSval=121975467 TSecr=121975447
 89 2016-10-18 22:21:38.776445     10.0.0.4 -> 10.0.0.1     TCP 66 targus-getdata1 > 38324 [ACK] Seq=1 Ack=28998 Win=87040 Len=0 TSval=121975448 TSecr=121975422
 90 2016-10-18 22:21:38.776505     10.0.0.1 -> 10.0.0.4     TCP 1514 38324 > targus-getdata1 [ACK] Seq=69542 Ack=1 Win=29696 Len=1448 TSval=121975468 TSecr=121975448
 91 2016-10-18 22:21:38.776516     10.0.0.1 -> 10.0.0.4     TCP 1514 38324 > targus-getdata1 [ACK] Seq=70990 Ack=1 Win=29696 Len=1448 TSval=121975468 TSecr=121975448
 92 2016-10-18 22:21:38.777690     10.0.0.4 -> 10.0.0.1     TCP 66 targus-getdata1 > 38324 [ACK] Seq=1 Ack=30446 Win=90112 Len=0 TSval=121975449 TSecr=121975423
 93 2016-10-18 22:21:38.777767     10.0.0.1 -> 10.0.0.4     TCP 1514 38324 > targus-getdata1 [ACK] Seq=72438 Ack=1 Win=29696 Len=1448 TSval=121975470 TSecr=121975449
 94 2016-10-18 22:21:38.777787     10.0.0.1 -> 10.0.0.4     TCP 1514 38324 > targus-getdata1 [ACK] Seq=73886 Ack=1 Win=29696 Len=1448 TSval=121975470 TSecr=121975449
 95 2016-10-18 22:21:38.778921     10.0.0.4 -> 10.0.0.1     TCP 66 targus-getdata1 > 38324 [ACK] Seq=1 Ack=31894 Win=92672 Len=0 TSval=121975451 TSecr=121975423
 96 2016-10-18 22:21:38.778992     10.0.0.1 -> 10.0.0.4     TCP 1514 38324 > targus-getdata1 [ACK] Seq=75334 Ack=1 Win=29696 Len=1448 TSval=121975471 TSecr=121975451
 97 2016-10-18 22:21:38.779003     10.0.0.1 -> 10.0.0.4     TCP 1514 38324 > targus-getdata1 [PSH, ACK] Seq=76782 Ack=1 Win=29696 Len=1448 TSval=121975471 TSecr=121975451
 98 2016-10-18 22:21:38.780020     10.0.0.4 -> 10.0.0.1     TCP 66 targus-getdata1 > 38324 [ACK] Seq=1 Ack=33342 Win=95744 Len=0 TSval=121975452 TSecr=121975424
 99 2016-10-18 22:21:38.780410     10.0.0.1 -> 10.0.0.4     TCP 1514 38324 > targus-getdata1 [ACK] Seq=78230 Ack=1 Win=29696 Len=1448 TSval=121975472 TSecr=121975452
100 2016-10-18 22:21:38.780461     10.0.0.1 -> 10.0.0.4     TCP 1514 38324 > targus-getdata1 [ACK] Seq=79678 Ack=1 Win=29696 Len=1448 TSval=121975472 TSecr=121975452
101 2016-10-18 22:21:38.781247     10.0.0.4 -> 10.0.0.1     TCP 66 targus-getdata1 > 38324 [ACK] Seq=1 Ack=34790 Win=98816 Len=0 TSval=121975453 TSecr=121975424
102 2016-10-18 22:21:38.781316     10.0.0.1 -> 10.0.0.4     TCP 1514 38324 > targus-getdata1 [ACK] Seq=81126 Ack=1 Win=29696 Len=1448 TSval=121975473 TSecr=121975453
103 2016-10-18 22:21:38.781337     10.0.0.1 -> 10.0.0.4     TCP 1514 38324 > targus-getdata1 [ACK] Seq=82574 Ack=1 Win=29696 Len=1448 TSval=121975473 TSecr=121975453
104 2016-10-18 22:21:38.782559     10.0.0.4 -> 10.0.0.1     TCP 66 targus-getdata1 > 38324 [ACK] Seq=1 Ack=36238 Win=101376 Len=0 TSval=121975454 TSecr=121975425
105 2016-10-18 22:21:38.782662     10.0.0.1 -> 10.0.0.4     TCP 1514 38324 > targus-getdata1 [ACK] Seq=84022 Ack=1 Win=29696 Len=1448 TSval=121975475 TSecr=121975454
106 2016-10-18 22:21:38.782683     10.0.0.1 -> 10.0.0.4     TCP 1514 38324 > targus-getdata1 [ACK] Seq=85470 Ack=1 Win=29696 Len=1448 TSval=121975475 TSecr=121975454
107 2016-10-18 22:21:38.783721     10.0.0.4 -> 10.0.0.1     TCP 66 targus-getdata1 > 38324 [ACK] Seq=1 Ack=37686 Win=104448 Len=0 TSval=121975456 TSecr=121975425
108 2016-10-18 22:21:38.783792     10.0.0.1 -> 10.0.0.4     TCP 1514 38324 > targus-getdata1 [ACK] Seq=86918 Ack=1 Win=29696 Len=1448 TSval=121975476 TSecr=121975456
109 2016-10-18 22:21:38.783824     10.0.0.1 -> 10.0.0.4     TCP 1514 38324 > targus-getdata1 [ACK] Seq=88366 Ack=1 Win=29696 Len=1448 TSval=121975476 TSecr=121975456
110 2016-10-18 22:21:38.784911     10.0.0.4 -> 10.0.0.1     TCP 66 targus-getdata1 > 38324 [ACK] Seq=1 Ack=39134 Win=107520 Len=0 TSval=121975457 TSecr=121975427
111 2016-10-18 22:21:38.784972     10.0.0.1 -> 10.0.0.4     TCP 1514 38324 > targus-getdata1 [ACK] Seq=89814 Ack=1 Win=29696 Len=1448 TSval=121975477 TSecr=121975457
112 2016-10-18 22:21:38.784990     10.0.0.1 -> 10.0.0.4     TCP 1514 38324 > targus-getdata1 [ACK] Seq=91262 Ack=1 Win=29696 Len=1448 TSval=121975477 TSecr=121975457
113 2016-10-18 22:21:38.786073     10.0.0.4 -> 10.0.0.1     TCP 66 targus-getdata1 > 38324 [ACK] Seq=1 Ack=40582 Win=110080 Len=0 TSval=121975458 TSecr=121975427
114 2016-10-18 22:21:38.786134     10.0.0.1 -> 10.0.0.4     TCP 1514 38324 > targus-getdata1 [ACK] Seq=92710 Ack=1 Win=29696 Len=1448 TSval=121975478 TSecr=121975458
115 2016-10-18 22:21:38.786153     10.0.0.1 -> 10.0.0.4     TCP 1514 38324 > targus-getdata1 [ACK] Seq=94158 Ack=1 Win=29696 Len=1448 TSval=121975478 TSecr=121975458
116 2016-10-18 22:21:38.787293     10.0.0.4 -> 10.0.0.1     TCP 66 targus-getdata1 > 38324 [ACK] Seq=1 Ack=42030 Win=113152 Len=0 TSval=121975459 TSecr=121975428
117 2016-10-18 22:21:38.787360     10.0.0.1 -> 10.0.0.4     TCP 1514 38324 > targus-getdata1 [ACK] Seq=95606 Ack=1 Win=29696 Len=1448 TSval=121975479 TSecr=121975459
118 2016-10-18 22:21:38.787379     10.0.0.1 -> 10.0.0.4     TCP 1514 38324 > targus-getdata1 [ACK] Seq=97054 Ack=1 Win=29696 Len=1448 TSval=121975479 TSecr=121975459
119 2016-10-18 22:21:38.788468     10.0.0.4 -> 10.0.0.1     TCP 66 targus-getdata1 > 38324 [ACK] Seq=1 Ack=43478 Win=116224 Len=0 TSval=121975460 TSecr=121975428
120 2016-10-18 22:21:38.788527     10.0.0.1 -> 10.0.0.4     TCP 1514 38324 > targus-getdata1 [ACK] Seq=98502 Ack=1 Win=29696 Len=1448 TSval=121975480 TSecr=121975460
121 2016-10-18 22:21:38.788547     10.0.0.1 -> 10.0.0.4     TCP 1514 38324 > targus-getdata1 [ACK] Seq=99950 Ack=1 Win=29696 Len=1448 TSval=121975480 TSecr=121975460
122 2016-10-18 22:21:38.807671     10.0.0.4 -> 10.0.0.1     TCP 66 targus-getdata1 > 38324 [ACK] Seq=1 Ack=44926 Win=118784 Len=0 TSval=121975479 TSecr=121975459
123 2016-10-18 22:21:38.807776     10.0.0.1 -> 10.0.0.4     TCP 1514 38324 > targus-getdata1 [ACK] Seq=101398 Ack=1 Win=29696 Len=1448 TSval=121975500 TSecr=121975479
124 2016-10-18 22:21:38.807798     10.0.0.1 -> 10.0.0.4     TCP 1514 38324 > targus-getdata1 [ACK] Seq=102846 Ack=1 Win=29696 Len=1448 TSval=121975500 TSecr=121975479
125 2016-10-18 22:21:38.807672     10.0.0.4 -> 10.0.0.1     TCP 66 targus-getdata1 > 38324 [ACK] Seq=1 Ack=46374 Win=121856 Len=0 TSval=121975479 TSecr=121975459
126 2016-10-18 22:21:38.807877     10.0.0.1 -> 10.0.0.4     TCP 1514 38324 > targus-getdata1 [ACK] Seq=104294 Ack=1 Win=29696 Len=1448 TSval=121975500 TSecr=121975479
127 2016-10-18 22:21:38.807893     10.0.0.1 -> 10.0.0.4     TCP 1514 38324 > targus-getdata1 [ACK] Seq=105742 Ack=1 Win=29696 Len=1448 TSval=121975500 TSecr=121975479
128 2016-10-18 22:21:38.808768     10.0.0.4 -> 10.0.0.1     TCP 66 targus-getdata1 > 38324 [ACK] Seq=1 Ack=47822 Win=124928 Len=0 TSval=121975481 TSecr=121975459
129 2016-10-18 22:21:38.808834     10.0.0.1 -> 10.0.0.4     TCP 1514 38324 > targus-getdata1 [ACK] Seq=107190 Ack=1 Win=29696 Len=1448 TSval=121975501 TSecr=121975481
130 2016-10-18 22:21:38.808853     10.0.0.1 -> 10.0.0.4     TCP 1514 38324 > targus-getdata1 [ACK] Seq=108638 Ack=1 Win=29696 Len=1448 TSval=121975501 TSecr=121975481
131 2016-10-18 22:21:38.809852     10.0.0.4 -> 10.0.0.1     TCP 66 targus-getdata1 > 38324 [ACK] Seq=1 Ack=49270 Win=127488 Len=0 TSval=121975482 TSecr=121975459
132 2016-10-18 22:21:38.809917     10.0.0.1 -> 10.0.0.4     TCP 1514 38324 > targus-getdata1 [ACK] Seq=110086 Ack=1 Win=29696 Len=1448 TSval=121975502 TSecr=121975482
133 2016-10-18 22:21:38.809940     10.0.0.1 -> 10.0.0.4     TCP 1514 38324 > targus-getdata1 [ACK] Seq=111534 Ack=1 Win=29696 Len=1448 TSval=121975502 TSecr=121975482
134 2016-10-18 22:21:38.811021     10.0.0.4 -> 10.0.0.1     TCP 66 targus-getdata1 > 38324 [ACK] Seq=1 Ack=50718 Win=130560 Len=0 TSval=121975483 TSecr=121975460
135 2016-10-18 22:21:38.811084     10.0.0.1 -> 10.0.0.4     TCP 1514 38324 > targus-getdata1 [ACK] Seq=112982 Ack=1 Win=29696 Len=1448 TSval=121975503 TSecr=121975483
136 2016-10-18 22:21:38.811106     10.0.0.1 -> 10.0.0.4     TCP 1514 38324 > targus-getdata1 [ACK] Seq=114430 Ack=1 Win=29696 Len=1448 TSval=121975503 TSecr=121975483
137 2016-10-18 22:21:38.812219     10.0.0.4 -> 10.0.0.1     TCP 66 targus-getdata1 > 38324 [ACK] Seq=1 Ack=52166 Win=133632 Len=0 TSval=121975484 TSecr=121975460
138 2016-10-18 22:21:38.812281     10.0.0.1 -> 10.0.0.4     TCP 1514 38324 > targus-getdata1 [ACK] Seq=115878 Ack=1 Win=29696 Len=1448 TSval=121975504 TSecr=121975484
139 2016-10-18 22:21:38.812300     10.0.0.1 -> 10.0.0.4     TCP 1514 38324 > targus-getdata1 [ACK] Seq=117326 Ack=1 Win=29696 Len=1448 TSval=121975504 TSecr=121975484
140 2016-10-18 22:21:38.813511     10.0.0.4 -> 10.0.0.1     TCP 66 targus-getdata1 > 38324 [ACK] Seq=1 Ack=53614 Win=136192 Len=0 TSval=121975485 TSecr=121975461
141 2016-10-18 22:21:38.813572     10.0.0.1 -> 10.0.0.4     TCP 1514 38324 > targus-getdata1 [ACK] Seq=118774 Ack=1 Win=29696 Len=1448 TSval=121975505 TSecr=121975485
142 2016-10-18 22:21:38.813591     10.0.0.1 -> 10.0.0.4     TCP 1514 38324 > targus-getdata1 [ACK] Seq=120222 Ack=1 Win=29696 Len=1448 TSval=121975505 TSecr=121975485
143 2016-10-18 22:21:38.814692     10.0.0.4 -> 10.0.0.1     TCP 66 targus-getdata1 > 38324 [ACK] Seq=1 Ack=55062 Win=139264 Len=0 TSval=121975486 TSecr=121975461
144 2016-10-18 22:21:38.814805     10.0.0.1 -> 10.0.0.4     TCP 1514 38324 > targus-getdata1 [ACK] Seq=121670 Ack=1 Win=29696 Len=1448 TSval=121975507 TSecr=121975486
145 2016-10-18 22:21:38.814837     10.0.0.1 -> 10.0.0.4     TCP 1514 38324 > targus-getdata1 [ACK] Seq=123118 Ack=1 Win=29696 Len=1448 TSval=121975507 TSecr=121975486
146 2016-10-18 22:21:38.815929     10.0.0.4 -> 10.0.0.1     TCP 66 targus-getdata1 > 38324 [ACK] Seq=1 Ack=56510 Win=142336 Len=0 TSval=121975488 TSecr=121975462
147 2016-10-18 22:21:38.815989     10.0.0.1 -> 10.0.0.4     TCP 1514 38324 > targus-getdata1 [ACK] Seq=124566 Ack=1 Win=29696 Len=1448 TSval=121975508 TSecr=121975488
148 2016-10-18 22:21:38.816007     10.0.0.1 -> 10.0.0.4     TCP 1514 38324 > targus-getdata1 [PSH, ACK] Seq=126014 Ack=1 Win=29696 Len=1448 TSval=121975508 TSecr=121975488
149 2016-10-18 22:21:38.817134     10.0.0.4 -> 10.0.0.1     TCP 66 targus-getdata1 > 38324 [ACK] Seq=1 Ack=57958 Win=144896 Len=0 TSval=121975489 TSecr=121975462
150 2016-10-18 22:21:38.817196     10.0.0.1 -> 10.0.0.4     TCP 1514 38324 > targus-getdata1 [PSH, ACK] Seq=127462 Ack=1 Win=29696 Len=1448 TSval=121975509 TSecr=121975489
151 2016-10-18 22:21:38.817272     10.0.0.1 -> 10.0.0.4     TCP 1514 38324 > targus-getdata1 [ACK] Seq=128910 Ack=1 Win=29696 Len=1448 TSval=121975509 TSecr=121975489
152 2016-10-18 22:21:38.818411     10.0.0.4 -> 10.0.0.1     TCP 66 targus-getdata1 > 38324 [ACK] Seq=1 Ack=59406 Win=147968 Len=0 TSval=121975490 TSecr=121975464
153 2016-10-18 22:21:38.818477     10.0.0.1 -> 10.0.0.4     TCP 1514 38324 > targus-getdata1 [ACK] Seq=130358 Ack=1 Win=29696 Len=1448 TSval=121975510 TSecr=121975490
154 2016-10-18 22:21:38.818495     10.0.0.1 -> 10.0.0.4     TCP 1514 38324 > targus-getdata1 [ACK] Seq=131806 Ack=1 Win=29696 Len=1448 TSval=121975510 TSecr=121975490
155 2016-10-18 22:21:38.819659     10.0.0.4 -> 10.0.0.1     TCP 66 targus-getdata1 > 38324 [ACK] Seq=1 Ack=60854 Win=151040 Len=0 TSval=121975491 TSecr=121975464
156 2016-10-18 22:21:38.819754     10.0.0.1 -> 10.0.0.4     TCP 1514 38324 > targus-getdata1 [ACK] Seq=133254 Ack=1 Win=29696 Len=1448 TSval=121975512 TSecr=121975491
157 2016-10-18 22:21:38.819768     10.0.0.1 -> 10.0.0.4     TCP 1514 38324 > targus-getdata1 [ACK] Seq=134702 Ack=1 Win=29696 Len=1448 TSval=121975512 TSecr=121975491
158 2016-10-18 22:21:38.820852     10.0.0.4 -> 10.0.0.1     TCP 66 targus-getdata1 > 38324 [ACK] Seq=1 Ack=62302 Win=153600 Len=0 TSval=121975493 TSecr=121975465
159 2016-10-18 22:21:38.820914     10.0.0.1 -> 10.0.0.4     TCP 1514 38324 > targus-getdata1 [ACK] Seq=136150 Ack=1 Win=29696 Len=1448 TSval=121975513 TSecr=121975493
160 2016-10-18 22:21:38.820936     10.0.0.1 -> 10.0.0.4     TCP 1514 38324 > targus-getdata1 [ACK] Seq=137598 Ack=1 Win=29696 Len=1448 TSval=121975513 TSecr=121975493
161 2016-10-18 22:21:38.821970     10.0.0.4 -> 10.0.0.1     TCP 66 targus-getdata1 > 38324 [ACK] Seq=1 Ack=63750 Win=156672 Len=0 TSval=121975494 TSecr=121975465
162 2016-10-18 22:21:38.822035     10.0.0.1 -> 10.0.0.4     TCP 1514 38324 > targus-getdata1 [ACK] Seq=139046 Ack=1 Win=29696 Len=1448 TSval=121975514 TSecr=121975494
163 2016-10-18 22:21:38.822053     10.0.0.1 -> 10.0.0.4     TCP 1514 38324 > targus-getdata1 [ACK] Seq=140494 Ack=1 Win=29696 Len=1448 TSval=121975514 TSecr=121975494
164 2016-10-18 22:21:38.823227     10.0.0.4 -> 10.0.0.1     TCP 66 targus-getdata1 > 38324 [ACK] Seq=1 Ack=65198 Win=159744 Len=0 TSval=121975495 TSecr=121975466
165 2016-10-18 22:21:38.823294     10.0.0.1 -> 10.0.0.4     TCP 1514 38324 > targus-getdata1 [ACK] Seq=141942 Ack=1 Win=29696 Len=1448 TSval=121975515 TSecr=121975495
166 2016-10-18 22:21:38.823312     10.0.0.1 -> 10.0.0.4     TCP 1514 38324 > targus-getdata1 [ACK] Seq=143390 Ack=1 Win=29696 Len=1448 TSval=121975515 TSecr=121975495
167 2016-10-18 22:21:38.824467     10.0.0.4 -> 10.0.0.1     TCP 66 targus-getdata1 > 38324 [ACK] Seq=1 Ack=66646 Win=162304 Len=0 TSval=121975496 TSecr=121975466
168 2016-10-18 22:21:38.824528     10.0.0.1 -> 10.0.0.4     TCP 1514 38324 > targus-getdata1 [ACK] Seq=144838 Ack=1 Win=29696 Len=1448 TSval=121975516 TSecr=121975496
169 2016-10-18 22:21:38.824543     10.0.0.1 -> 10.0.0.4     TCP 1514 38324 > targus-getdata1 [ACK] Seq=146286 Ack=1 Win=29696 Len=1448 TSval=121975516 TSecr=121975496
170 2016-10-18 22:21:38.825643     10.0.0.4 -> 10.0.0.1     TCP 66 targus-getdata1 > 38324 [ACK] Seq=1 Ack=68094 Win=165376 Len=0 TSval=121975497 TSecr=121975467
171 2016-10-18 22:21:38.825756     10.0.0.1 -> 10.0.0.4     TCP 1514 38324 > targus-getdata1 [ACK] Seq=147734 Ack=1 Win=29696 Len=1448 TSval=121975518 TSecr=121975497
172 2016-10-18 22:21:38.825790     10.0.0.1 -> 10.0.0.4     TCP 1514 38324 > targus-getdata1 [ACK] Seq=149182 Ack=1 Win=29696 Len=1448 TSval=121975518 TSecr=121975497
173 2016-10-18 22:21:38.826924     10.0.0.4 -> 10.0.0.1     TCP 66 targus-getdata1 > 38324 [ACK] Seq=1 Ack=69542 Win=168448 Len=0 TSval=121975499 TSecr=121975467
174 2016-10-18 22:21:38.826988     10.0.0.1 -> 10.0.0.4     TCP 1514 38324 > targus-getdata1 [ACK] Seq=150630 Ack=1 Win=29696 Len=1448 TSval=121975519 TSecr=121975499
175 2016-10-18 22:21:38.827006     10.0.0.1 -> 10.0.0.4     TCP 1514 38324 > targus-getdata1 [ACK] Seq=152078 Ack=1 Win=29696 Len=1448 TSval=121975519 TSecr=121975499
176 2016-10-18 22:21:38.828262     10.0.0.4 -> 10.0.0.1     TCP 66 targus-getdata1 > 38324 [ACK] Seq=1 Ack=70990 Win=171008 Len=0 TSval=121975500 TSecr=121975468
177 2016-10-18 22:21:38.828334     10.0.0.1 -> 10.0.0.4     TCP 1514 38324 > targus-getdata1 [ACK] Seq=153526 Ack=1 Win=29696 Len=1448 TSval=121975520 TSecr=121975500
178 2016-10-18 22:21:38.828354     10.0.0.1 -> 10.0.0.4     TCP 1514 38324 > targus-getdata1 [ACK] Seq=154974 Ack=1 Win=29696 Len=1448 TSval=121975520 TSecr=121975500
179 2016-10-18 22:21:38.829182     10.0.0.4 -> 10.0.0.1     TCP 66 targus-getdata1 > 38324 [ACK] Seq=1 Ack=72438 Win=174080 Len=0 TSval=121975501 TSecr=121975468
180 2016-10-18 22:21:38.829240     10.0.0.1 -> 10.0.0.4     TCP 1514 38324 > targus-getdata1 [ACK] Seq=156422 Ack=1 Win=29696 Len=1448 TSval=121975521 TSecr=121975501
181 2016-10-18 22:21:38.829254     10.0.0.1 -> 10.0.0.4     TCP 1514 38324 > targus-getdata1 [ACK] Seq=157870 Ack=1 Win=29696 Len=1448 TSval=121975521 TSecr=121975501
182 2016-10-18 22:21:38.830601     10.0.0.4 -> 10.0.0.1     TCP 66 targus-getdata1 > 38324 [ACK] Seq=1 Ack=73886 Win=177152 Len=0 TSval=121975502 TSecr=121975470
183 2016-10-18 22:21:38.830725     10.0.0.1 -> 10.0.0.4     TCP 1514 38324 > targus-getdata1 [ACK] Seq=159318 Ack=1 Win=29696 Len=1448 TSval=121975523 TSecr=121975502
184 2016-10-18 22:21:38.830741     10.0.0.1 -> 10.0.0.4     TCP 1514 38324 > targus-getdata1 [ACK] Seq=160766 Ack=1 Win=29696 Len=1448 TSval=121975523 TSecr=121975502
185 2016-10-18 22:21:38.831640     10.0.0.4 -> 10.0.0.1     TCP 66 targus-getdata1 > 38324 [ACK] Seq=1 Ack=75334 Win=179712 Len=0 TSval=121975503 TSecr=121975470
186 2016-10-18 22:21:38.831753     10.0.0.1 -> 10.0.0.4     TCP 1514 38324 > targus-getdata1 [ACK] Seq=162214 Ack=1 Win=29696 Len=1448 TSval=121975524 TSecr=121975503
187 2016-10-18 22:21:38.831772     10.0.0.1 -> 10.0.0.4     TCP 1514 38324 > targus-getdata1 [ACK] Seq=163662 Ack=1 Win=29696 Len=1448 TSval=121975524 TSecr=121975503
188 2016-10-18 22:21:38.832801     10.0.0.4 -> 10.0.0.1     TCP 66 targus-getdata1 > 38324 [ACK] Seq=1 Ack=76782 Win=182784 Len=0 TSval=121975505 TSecr=121975471
189 2016-10-18 22:21:38.832864     10.0.0.1 -> 10.0.0.4     TCP 1514 38324 > targus-getdata1 [ACK] Seq=165110 Ack=1 Win=29696 Len=1448 TSval=121975525 TSecr=121975505
190 2016-10-18 22:21:38.832881     10.0.0.1 -> 10.0.0.4     TCP 1514 38324 > targus-getdata1 [ACK] Seq=166558 Ack=1 Win=29696 Len=1448 TSval=121975525 TSecr=121975505
191 2016-10-18 22:21:38.834070     10.0.0.4 -> 10.0.0.1     TCP 66 targus-getdata1 > 38324 [ACK] Seq=1 Ack=78230 Win=185344 Len=0 TSval=121975506 TSecr=121975471
192 2016-10-18 22:21:38.834131     10.0.0.1 -> 10.0.0.4     TCP 1514 38324 > targus-getdata1 [ACK] Seq=168006 Ack=1 Win=29696 Len=1448 TSval=121975526 TSecr=121975506
193 2016-10-18 22:21:38.834149     10.0.0.1 -> 10.0.0.4     TCP 1514 38324 > targus-getdata1 [ACK] Seq=169454 Ack=1 Win=29696 Len=1448 TSval=121975526 TSecr=121975506
194 2016-10-18 22:21:38.835234     10.0.0.4 -> 10.0.0.1     TCP 66 targus-getdata1 > 38324 [ACK] Seq=1 Ack=79678 Win=188416 Len=0 TSval=121975507 TSecr=121975472
195 2016-10-18 22:21:38.835297     10.0.0.1 -> 10.0.0.4     TCP 1514 38324 > targus-getdata1 [ACK] Seq=170902 Ack=1 Win=29696 Len=1448 TSval=121975527 TSecr=121975507
196 2016-10-18 22:21:38.835315     10.0.0.1 -> 10.0.0.4     TCP 1514 38324 > targus-getdata1 [ACK] Seq=172350 Ack=1 Win=29696 Len=1448 TSval=121975527 TSecr=121975507
197 2016-10-18 22:21:38.836476     10.0.0.4 -> 10.0.0.1     TCP 66 targus-getdata1 > 38324 [ACK] Seq=1 Ack=81126 Win=191488 Len=0 TSval=121975508 TSecr=121975472
198 2016-10-18 22:21:38.836538     10.0.0.1 -> 10.0.0.4     TCP 1514 38324 > targus-getdata1 [ACK] Seq=173798 Ack=1 Win=29696 Len=1448 TSval=121975528 TSecr=121975508
199 2016-10-18 22:21:38.836552     10.0.0.1 -> 10.0.0.4     TCP 1514 38324 > targus-getdata1 [ACK] Seq=175246 Ack=1 Win=29696 Len=1448 TSval=121975528 TSecr=121975508
200 2016-10-18 22:21:38.837694     10.0.0.4 -> 10.0.0.1     TCP 66 targus-getdata1 > 38324 [ACK] Seq=1 Ack=82574 Win=194048 Len=0 TSval=121975509 TSecr=121975473
201 2016-10-18 22:21:38.837760     10.0.0.1 -> 10.0.0.4     TCP 1514 38324 > targus-getdata1 [ACK] Seq=176694 Ack=1 Win=29696 Len=1448 TSval=121975530 TSecr=121975509
202 2016-10-18 22:21:38.837793     10.0.0.1 -> 10.0.0.4     TCP 1514 38324 > targus-getdata1 [ACK] Seq=178142 Ack=1 Win=29696 Len=1448 TSval=121975530 TSecr=121975509
203 2016-10-18 22:21:38.838846     10.0.0.4 -> 10.0.0.1     TCP 66 targus-getdata1 > 38324 [ACK] Seq=1 Ack=84022 Win=197120 Len=0 TSval=121975511 TSecr=121975473
204 2016-10-18 22:21:38.838911     10.0.0.1 -> 10.0.0.4     TCP 1514 38324 > targus-getdata1 [ACK] Seq=179590 Ack=1 Win=29696 Len=1448 TSval=121975531 TSecr=121975511
205 2016-10-18 22:21:38.838929     10.0.0.1 -> 10.0.0.4     TCP 1514 38324 > targus-getdata1 [ACK] Seq=181038 Ack=1 Win=29696 Len=1448 TSval=121975531 TSecr=121975511
206 2016-10-18 22:21:38.840097     10.0.0.4 -> 10.0.0.1     TCP 66 targus-getdata1 > 38324 [ACK] Seq=1 Ack=85470 Win=200192 Len=0 TSval=121975512 TSecr=121975475
207 2016-10-18 22:21:38.840158     10.0.0.1 -> 10.0.0.4     TCP 1514 38324 > targus-getdata1 [ACK] Seq=182486 Ack=1 Win=29696 Len=1448 TSval=121975532 TSecr=121975512
208 2016-10-18 22:21:38.840172     10.0.0.1 -> 10.0.0.4     TCP 1514 38324 > targus-getdata1 [ACK] Seq=183934 Ack=1 Win=29696 Len=1448 TSval=121975532 TSecr=121975512
209 2016-10-18 22:21:38.841284     10.0.0.4 -> 10.0.0.1     TCP 66 targus-getdata1 > 38324 [ACK] Seq=1 Ack=86918 Win=202752 Len=0 TSval=121975513 TSecr=121975475
210 2016-10-18 22:21:38.841345     10.0.0.1 -> 10.0.0.4     TCP 1514 38324 > targus-getdata1 [ACK] Seq=185382 Ack=1 Win=29696 Len=1448 TSval=121975533 TSecr=121975513
211 2016-10-18 22:21:38.841355     10.0.0.1 -> 10.0.0.4     TCP 1514 38324 > targus-getdata1 [ACK] Seq=186830 Ack=1 Win=29696 Len=1448 TSval=121975533 TSecr=121975513
212 2016-10-18 22:21:38.842504     10.0.0.4 -> 10.0.0.1     TCP 66 targus-getdata1 > 38324 [ACK] Seq=1 Ack=88366 Win=205824 Len=0 TSval=121975514 TSecr=121975476
213 2016-10-18 22:21:38.842567     10.0.0.1 -> 10.0.0.4     TCP 1514 38324 > targus-getdata1 [ACK] Seq=188278 Ack=1 Win=29696 Len=1448 TSval=121975534 TSecr=121975514
214 2016-10-18 22:21:38.842581     10.0.0.1 -> 10.0.0.4     TCP 1514 38324 > targus-getdata1 [ACK] Seq=189726 Ack=1 Win=29696 Len=1448 TSval=121975534 TSecr=121975514
215 2016-10-18 22:21:38.843778     10.0.0.4 -> 10.0.0.1     TCP 66 targus-getdata1 > 38324 [ACK] Seq=1 Ack=89814 Win=208896 Len=0 TSval=121975516 TSecr=121975476
216 2016-10-18 22:21:38.843864     10.0.0.1 -> 10.0.0.4     TCP 1514 38324 > targus-getdata1 [ACK] Seq=191174 Ack=1 Win=29696 Len=1448 TSval=121975536 TSecr=121975516
217 2016-10-18 22:21:38.843882     10.0.0.1 -> 10.0.0.4     TCP 1514 38324 > targus-getdata1 [ACK] Seq=192622 Ack=1 Win=29696 Len=1448 TSval=121975536 TSecr=121975516
218 2016-10-18 22:21:38.844916     10.0.0.4 -> 10.0.0.1     TCP 66 targus-getdata1 > 38324 [ACK] Seq=1 Ack=91262 Win=211456 Len=0 TSval=121975517 TSecr=121975477
219 2016-10-18 22:21:38.844973     10.0.0.1 -> 10.0.0.4     TCP 1514 38324 > targus-getdata1 [ACK] Seq=194070 Ack=1 Win=29696 Len=1448 TSval=121975537 TSecr=121975517
220 2016-10-18 22:21:38.844983     10.0.0.1 -> 10.0.0.4     TCP 1514 38324 > targus-getdata1 [ACK] Seq=195518 Ack=1 Win=29696 Len=1448 TSval=121975537 TSecr=121975517
221 2016-10-18 22:21:38.846120     10.0.0.4 -> 10.0.0.1     TCP 66 targus-getdata1 > 38324 [ACK] Seq=1 Ack=92710 Win=214528 Len=0 TSval=121975518 TSecr=121975477
222 2016-10-18 22:21:38.846184     10.0.0.1 -> 10.0.0.4     TCP 1514 38324 > targus-getdata1 [ACK] Seq=196966 Ack=1 Win=29696 Len=1448 TSval=121975538 TSecr=121975518
223 2016-10-18 22:21:38.846197     10.0.0.1 -> 10.0.0.4     TCP 1514 38324 > targus-getdata1 [ACK] Seq=198414 Ack=1 Win=29696 Len=1448 TSval=121975538 TSecr=121975518
224 2016-10-18 22:21:38.847297     10.0.0.4 -> 10.0.0.1     TCP 66 targus-getdata1 > 38324 [ACK] Seq=1 Ack=94158 Win=217600 Len=0 TSval=121975519 TSecr=121975478
225 2016-10-18 22:21:38.847355     10.0.0.1 -> 10.0.0.4     TCP 1514 38324 > targus-getdata1 [ACK] Seq=199862 Ack=1 Win=29696 Len=1448 TSval=121975539 TSecr=121975519
226 2016-10-18 22:21:38.847373     10.0.0.1 -> 10.0.0.4     TCP 1514 38324 > targus-getdata1 [PSH, ACK] Seq=201310 Ack=1 Win=29696 Len=1448 TSval=121975539 TSecr=121975519
227 2016-10-18 22:21:38.848671     10.0.0.4 -> 10.0.0.1     TCP 66 targus-getdata1 > 38324 [ACK] Seq=1 Ack=95606 Win=220160 Len=0 TSval=121975520 TSecr=121975478
228 2016-10-18 22:21:38.848992     10.0.0.1 -> 10.0.0.4     TCP 1514 38324 > targus-getdata1 [ACK] Seq=202758 Ack=1 Win=29696 Len=1448 TSval=121975541 TSecr=121975520
229 2016-10-18 22:21:38.849033     10.0.0.1 -> 10.0.0.4     TCP 1514 38324 > targus-getdata1 [ACK] Seq=204206 Ack=1 Win=29696 Len=1448 TSval=121975541 TSecr=121975520
230 2016-10-18 22:21:38.849781     10.0.0.4 -> 10.0.0.1     TCP 66 targus-getdata1 > 38324 [ACK] Seq=1 Ack=97054 Win=223232 Len=0 TSval=121975522 TSecr=121975479
231 2016-10-18 22:21:38.849845     10.0.0.1 -> 10.0.0.4     TCP 1514 38324 > targus-getdata1 [ACK] Seq=205654 Ack=1 Win=29696 Len=1448 TSval=121975542 TSecr=121975522
232 2016-10-18 22:21:38.849863     10.0.0.1 -> 10.0.0.4     TCP 1514 38324 > targus-getdata1 [ACK] Seq=207102 Ack=1 Win=29696 Len=1448 TSval=121975542 TSecr=121975522
233 2016-10-18 22:21:38.851028     10.0.0.4 -> 10.0.0.1     TCP 66 targus-getdata1 > 38324 [ACK] Seq=1 Ack=98502 Win=226304 Len=0 TSval=121975523 TSecr=121975479
234 2016-10-18 22:21:38.851093     10.0.0.1 -> 10.0.0.4     TCP 1514 38324 > targus-getdata1 [ACK] Seq=208550 Ack=1 Win=29696 Len=1448 TSval=121975543 TSecr=121975523
235 2016-10-18 22:21:38.851110     10.0.0.1 -> 10.0.0.4     TCP 1514 38324 > targus-getdata1 [ACK] Seq=209998 Ack=1 Win=29696 Len=1448 TSval=121975543 TSecr=121975523
236 2016-10-18 22:21:38.852180     10.0.0.4 -> 10.0.0.1     TCP 66 targus-getdata1 > 38324 [ACK] Seq=1 Ack=99950 Win=228864 Len=0 TSval=121975524 TSecr=121975480
237 2016-10-18 22:21:38.852240     10.0.0.1 -> 10.0.0.4     TCP 1514 38324 > targus-getdata1 [ACK] Seq=211446 Ack=1 Win=29696 Len=1448 TSval=121975544 TSecr=121975524
238 2016-10-18 22:21:38.852253     10.0.0.1 -> 10.0.0.4     TCP 1514 38324 > targus-getdata1 [ACK] Seq=212894 Ack=1 Win=29696 Len=1448 TSval=121975544 TSecr=121975524
239 2016-10-18 22:21:38.853425     10.0.0.4 -> 10.0.0.1     TCP 66 targus-getdata1 > 38324 [ACK] Seq=1 Ack=101398 Win=231936 Len=0 TSval=121975525 TSecr=121975480
240 2016-10-18 22:21:38.853484     10.0.0.1 -> 10.0.0.4     TCP 1514 38324 > targus-getdata1 [ACK] Seq=214342 Ack=1 Win=29696 Len=1448 TSval=121975545 TSecr=121975525
241 2016-10-18 22:21:38.853493     10.0.0.1 -> 10.0.0.4     TCP 1514 38324 > targus-getdata1 [ACK] Seq=215790 Ack=1 Win=29696 Len=1448 TSval=121975545 TSecr=121975525
242 2016-10-18 22:21:38.854592     10.0.0.4 -> 10.0.0.1     TCP 66 targus-getdata1 > 38324 [ACK] Seq=1 Ack=102846 Win=235008 Len=0 TSval=121975526 TSecr=121975500
