  1 2016-10-18 22:21:30.390782      0.0.0.0 -> 255.255.255.255 DHCP 342 DHCP Discover - Transaction ID 0x8508574f
  2 2016-10-18 22:21:33.485285      0.0.0.0 -> 255.255.255.255 DHCP 342 DHCP Discover - Transaction ID 0x8508574f
  3 2016-10-18 22:21:38.376668     10.0.0.1 -> 10.0.0.4     TCP 74 38323 > targus-getdata1 [SYN] Seq=0 Win=29200 Len=0 MSS=1460 SACK_PERM=1 TSval=121975047 TSecr=0 WS=512
  4 2016-10-18 22:21:38.376714     10.0.0.4 -> 10.0.0.1     TCP 74 targus-getdata1 > 38323 [SYN, ACK] Seq=0 Ack=1 Win=28960 Len=0 MSS=1460 SACK_PERM=1 TSval=121975069 TSecr=121975047 WS=512
  5 2016-10-18 22:21:38.417661     10.0.0.1 -> 10.0.0.4     TCP 66 38323 > targus-getdata1 [ACK] Seq=1 Ack=1 Win=29696 Len=0 TSval=121975089 TSecr=121975069
  6 2016-10-18 22:21:38.418187     10.0.0.1 -> 10.0.0.4     TCP 103 38323 > targus-getdata1 [PSH, ACK] Seq=1 Ack=1 Win=29696 Len=37 TSval=121975090 TSecr=121975069
  7 2016-10-18 22:21:38.418271     10.0.0.4 -> 10.0.0.1     TCP 66 targus-getdata1 > 38323 [ACK] Seq=1 Ack=38 Win=29184 Len=0 TSval=121975110 TSecr=121975090
  8 2016-10-18 22:21:38.418332     10.0.0.4 -> 10.0.0.1     TCP 67 targus-getdata1 > 38323 [PSH, ACK] Seq=1 Ack=38 Win=29184 Len=1 TSval=121975110 TSecr=121975090
  9 2016-10-18 22:21:38.458806     10.0.0.1 -> 10.0.0.4     TCP 66 38323 > targus-getdata1 [ACK] Seq=38 Ack=2 Win=29696 Len=0 TSval=121975130 TSecr=121975110
 10 2016-10-18 22:21:38.459316     10.0.0.1 -> 10.0.0.4     TCP 70 38323 > targus-getdata1 [PSH, ACK] Seq=38 Ack=2 Win=29696 Len=4 TSval=121975131 TSecr=121975110
 11 2016-10-18 22:21:38.498710     10.0.0.4 -> 10.0.0.1     TCP 66 targus-getdata1 > 38323 [ACK] Seq=2 Ack=42 Win=29184 Len=0 TSval=121975191 TSecr=121975131
 12 2016-10-18 22:21:38.539313     10.0.0.1 -> 10.0.0.4     TCP 123 38323 > targus-getdata1 [PSH, ACK] Seq=42 Ack=2 Win=29696 Len=57 TSval=121975211 TSecr=121975191
 13 2016-10-18 22:21:38.539437     10.0.0.4 -> 10.0.0.1     TCP 66 targus-getdata1 > 38323 [ACK] Seq=2 Ack=99 Win=29184 Len=0 TSval=121975231 TSecr=121975211
 14 2016-10-18 22:21:38.539530     10.0.0.4 -> 10.0.0.1     TCP 67 targus-getdata1 > 38323 [PSH, ACK] Seq=2 Ack=99 Win=29184 Len=1 TSval=121975231 TSecr=121975211
 15 2016-10-18 22:21:38.580173     10.0.0.1 -> 10.0.0.4     TCP 74 38324 > targus-getdata1 [SYN] Seq=0 Win=29200 Len=0 MSS=1460 SACK_PERM=1 TSval=121975252 TSecr=0 WS=512
 16 2016-10-18 22:21:38.580218     10.0.0.4 -> 10.0.0.1     TCP 74 targus-getdata1 > 38324 [SYN, ACK] Seq=0 Ack=1 Win=28960 Len=0 MSS=1460 SACK_PERM=1 TSval=121975272 TSecr=121975252 WS=512
 17 2016-10-18 22:21:38.619138     10.0.0.1 -> 10.0.0.4     TCP 66 38323 > targus-getdata1 [ACK] Seq=99 Ack=3 Win=29696 Len=0 TSval=121975291 TSecr=121975231
 18 2016-10-18 22:21:38.620710     10.0.0.1 -> 10.0.0.4     TCP 66 38324 > targus-getdata1 [ACK] Seq=1 Ack=1 Win=29696 Len=0 TSval=121975292 TSecr=121975272
 19 2016-10-18 22:21:38.620787     10.0.0.1 -> 10.0.0.4     TCP 103 38324 > targus-getdata1 [PSH, ACK] Seq=1 Ack=1 Win=29696 Len=37 TSval=121975292 TSecr=121975272
 20 2016-10-18 22:21:38.620815     10.0.0.4 -> 10.0.0.1     TCP 66 targus-getdata1 > 38324 [ACK] Seq=1 Ack=38 Win=29184 Len=0 TSval=121975313 TSecr=121975292
 21 2016-10-18 22:21:38.625049     10.0.0.4 -> 10.0.0.1     TCP 67 targus-getdata1 > 38323 [PSH, ACK] Seq=3 Ack=99 Win=29184 Len=1 TSval=121975317 TSecr=121975291
 22 2016-10-18 22:21:38.665474     10.0.0.1 -> 10.0.0.4     TCP 66 38323 > targus-getdata1 [ACK] Seq=99 Ack=4 Win=29696 Len=0 TSval=121975337 TSecr=121975317
 23 2016-10-18 22:21:38.665526     10.0.0.4 -> 10.0.0.1     TCP 67 targus-getdata1 > 38323 [PSH, ACK] Seq=4 Ack=99 Win=29184 Len=1 TSval=121975357 TSecr=121975337[Malformed Packet]
 24 2016-10-18 22:21:38.705978     10.0.0.1 -> 10.0.0.4     TCP 66 38323 > targus-getdata1 [ACK] Seq=99 Ack=5 Win=29696 Len=0 TSval=121975378 TSecr=121975357
 25 2016-10-18 22:21:38.706039     10.0.0.1 -> 10.0.0.4     TCP 1514 38324 > targus-getdata1 [ACK] Seq=38 Ack=1 Win=29696 Len=1448 TSval=121975378 TSecr=121975313
 26 2016-10-18 22:21:38.706055     10.0.0.4 -> 10.0.0.1     TCP 66 targus-getdata1 > 38324 [ACK] Seq=1 Ack=1486 Win=32256 Len=0 TSval=121975398 TSecr=121975378
 27 2016-10-18 22:21:38.706483     10.0.0.1 -> 10.0.0.4     TCP 1514 38324 > targus-getdata1 [ACK] Seq=1486 Ack=1 Win=29696 Len=1448 TSval=121975378 TSecr=121975313
 28 2016-10-18 22:21:38.706520     10.0.0.4 -> 10.0.0.1     TCP 66 targus-getdata1 > 38324 [ACK] Seq=1 Ack=2934 Win=34816 Len=0 TSval=121975398 TSecr=121975378
 29 2016-10-18 22:21:38.707133     10.0.0.1 -> 10.0.0.4     TCP 1514 38324 > targus-getdata1 [ACK] Seq=2934 Ack=1 Win=29696 Len=1448 TSval=121975378 TSecr=121975313
 30 2016-10-18 22:21:38.707172     10.0.0.4 -> 10.0.0.1     TCP 66 targus-getdata1 > 38324 [ACK] Seq=1 Ack=4382 Win=37888 Len=0 TSval=121975399 TSecr=121975378
 31 2016-10-18 22:21:38.708435     10.0.0.1 -> 10.0.0.4     TCP 1514 38324 > targus-getdata1 [ACK] Seq=4382 Ack=1 Win=29696 Len=1448 TSval=121975378 TSecr=121975313
 32 2016-10-18 22:21:38.708485     10.0.0.4 -> 10.0.0.1     TCP 66 targus-getdata1 > 38324 [ACK] Seq=1 Ack=5830 Win=40960 Len=0 TSval=121975400 TSecr=121975378
 33 2016-10-18 22:21:38.709671     10.0.0.1 -> 10.0.0.4     TCP 1514 38324 > targus-getdata1 [ACK] Seq=5830 Ack=1 Win=29696 Len=1448 TSval=121975378 TSecr=121975313
 34 2016-10-18 22:21:38.709721     10.0.0.4 -> 10.0.0.1     TCP 66 targus-getdata1 > 38324 [ACK] Seq=1 Ack=7278 Win=43520 Len=0 TSval=121975402 TSecr=121975378
 35 2016-10-18 22:21:38.710906     10.0.0.1 -> 10.0.0.4     TCP 1514 38324 > targus-getdata1 [ACK] Seq=7278 Ack=1 Win=29696 Len=1448 TSval=121975378 TSecr=121975313
 36 2016-10-18 22:21:38.710950     10.0.0.4 -> 10.0.0.1     TCP 66 targus-getdata1 > 38324 [ACK] Seq=1 Ack=8726 Win=46592 Len=0 TSval=121975403 TSecr=121975378
 37 2016-10-18 22:21:38.711999     10.0.0.1 -> 10.0.0.4     TCP 1514 38324 > targus-getdata1 [ACK] Seq=8726 Ack=1 Win=29696 Len=1448 TSval=121975378 TSecr=121975313
 38 2016-10-18 22:21:38.712045     10.0.0.4 -> 10.0.0.1     TCP 66 targus-getdata1 > 38324 [ACK] Seq=1 Ack=10174 Win=49664 Len=0 TSval=121975404 TSecr=121975378
 39 2016-10-18 22:21:38.713227     10.0.0.1 -> 10.0.0.4     TCP 1514 38324 > targus-getdata1 [ACK] Seq=10174 Ack=1 Win=29696 Len=1448 TSval=121975378 TSecr=121975313
 40 2016-10-18 22:21:38.713270     10.0.0.4 -> 10.0.0.1     TCP 66 targus-getdata1 > 38324 [ACK] Seq=1 Ack=11622 Win=52224 Len=0 TSval=121975405 TSecr=121975378
 41 2016-10-18 22:21:38.714485     10.0.0.1 -> 10.0.0.4     TCP 1514 38324 > targus-getdata1 [ACK] Seq=11622 Ack=1 Win=29696 Len=1448 TSval=121975378 TSecr=121975313
 42 2016-10-18 22:21:38.714538     10.0.0.4 -> 10.0.0.1     TCP 66 targus-getdata1 > 38324 [ACK] Seq=1 Ack=13070 Win=55296 Len=0 TSval=121975406 TSecr=121975378
 43 2016-10-18 22:21:38.715723     10.0.0.1 -> 10.0.0.4     TCP 1514 38324 > targus-getdata1 [ACK] Seq=13070 Ack=1 Win=29696 Len=1448 TSval=121975378 TSecr=121975313
 44 2016-10-18 22:21:38.715770     10.0.0.4 -> 10.0.0.1     TCP 66 targus-getdata1 > 38324 [ACK] Seq=1 Ack=14518 Win=58368 Len=0 TSval=121975408 TSecr=121975378
 45 2016-10-18 22:21:38.746710     10.0.0.1 -> 10.0.0.4     TCP 1514 38324 > targus-getdata1 [PSH, ACK] Seq=14518 Ack=1 Win=29696 Len=1448 TSval=121975418 TSecr=121975398
 46 2016-10-18 22:21:38.746761     10.0.0.4 -> 10.0.0.1     TCP 66 targus-getdata1 > 38324 [ACK] Seq=1 Ack=15966 Win=60928 Len=0 TSval=121975439 TSecr=121975418
 47 2016-10-18 22:21:38.746780     10.0.0.1 -> 10.0.0.4     TCP 1514 38324 > targus-getdata1 [ACK] Seq=15966 Ack=1 Win=29696 Len=1448 TSval=121975418 TSecr=121975398
 48 2016-10-18 22:21:38.746797     10.0.0.4 -> 10.0.0.1     TCP 66 targus-getdata1 > 38324 [ACK] Seq=1 Ack=17414 Win=64000 Len=0 TSval=121975439 TSecr=121975418
 49 2016-10-18 22:21:38.747803     10.0.0.1 -> 10.0.0.4     TCP 1514 38324 > targus-getdata1 [ACK] Seq=17414 Ack=1 Win=29696 Len=1448 TSval=121975419 TSecr=121975398
 50 2016-10-18 22:21:38.747844     10.0.0.4 -> 10.0.0.1     TCP 66 targus-getdata1 > 38324 [ACK] Seq=1 Ack=18862 Win=67072 Len=0 TSval=121975440 TSecr=121975419
 51 2016-10-18 22:21:38.749030     10.0.0.1 -> 10.0.0.4     TCP 1514 38324 > targus-getdata1 [ACK] Seq=18862 Ack=1 Win=29696 Len=1448 TSval=121975419 TSecr=121975398
 52 2016-10-18 22:21:38.749079     10.0.0.4 -> 10.0.0.1     TCP 66 targus-getdata1 > 38324 [ACK] Seq=1 Ack=20310 Win=69632 Len=0 TSval=121975441 TSecr=121975419
 53 2016-10-18 22:21:38.750245     10.0.0.1 -> 10.0.0.4     TCP 1514 38324 > targus-getdata1 [ACK] Seq=20310 Ack=1 Win=29696 Len=1448 TSval=121975419 TSecr=121975399
 54 2016-10-18 22:21:38.750285     10.0.0.4 -> 10.0.0.1     TCP 66 targus-getdata1 > 38324 [ACK] Seq=1 Ack=21758 Win=72704 Len=0 TSval=121975442 TSecr=121975419
 55 2016-10-18 22:21:38.751526     10.0.0.1 -> 10.0.0.4     TCP 1514 38324 > targus-getdata1 [ACK] Seq=21758 Ack=1 Win=29696 Len=1448 TSval=121975419 TSecr=121975399
 56 2016-10-18 22:21:38.751574     10.0.0.4 -> 10.0.0.1     TCP 66 targus-getdata1 > 38324 [ACK] Seq=1 Ack=23206 Win=75776 Len=0 TSval=121975443 TSecr=121975419
 57 2016-10-18 22:21:38.752748     10.0.0.1 -> 10.0.0.4     TCP 1514 38324 > targus-getdata1 [ACK] Seq=23206 Ack=1 Win=29696 Len=1448 TSval=121975421 TSecr=121975400
 58 2016-10-18 22:21:38.752804     10.0.0.4 -> 10.0.0.1     TCP 66 targus-getdata1 > 38324 [ACK] Seq=1 Ack=24654 Win=78336 Len=0 TSval=121975445 TSecr=121975421
 59 2016-10-18 22:21:38.753875     10.0.0.1 -> 10.0.0.4     TCP 1514 38324 > targus-getdata1 [ACK] Seq=24654 Ack=1 Win=29696 Len=1448 TSval=121975421 TSecr=121975400
 60 2016-10-18 22:21:38.753918     10.0.0.4 -> 10.0.0.1     TCP 66 targus-getdata1 > 38324 [ACK] Seq=1 Ack=26102 Win=81408 Len=0 TSval=121975446 TSecr=121975421
 61 2016-10-18 22:21:38.755069     10.0.0.1 -> 10.0.0.4     TCP 1514 38324 > targus-getdata1 [ACK] Seq=26102 Ack=1 Win=29696 Len=1448 TSval=121975422 TSecr=121975402
 62 2016-10-18 22:21:38.755113     10.0.0.4 -> 10.0.0.1     TCP 66 targus-getdata1 > 38324 [ACK] Seq=1 Ack=27550 Win=84480 Len=0 TSval=121975447 TSecr=121975422
 63 2016-10-18 22:21:38.756344     10.0.0.1 -> 10.0.0.4     TCP 1514 38324 > targus-getdata1 [ACK] Seq=27550 Ack=1 Win=29696 Len=1448 TSval=121975422 TSecr=121975402
 64 2016-10-18 22:21:38.756393     10.0.0.4 -> 10.0.0.1     TCP 66 targus-getdata1 > 38324 [ACK] Seq=1 Ack=28998 Win=87040 Len=0 TSval=121975448 TSecr=121975422
 65 2016-10-18 22:21:38.757553     10.0.0.1 -> 10.0.0.4     TCP 1514 38324 > targus-getdata1 [ACK] Seq=28998 Ack=1 Win=29696 Len=1448 TSval=121975423 TSecr=121975403
 66 2016-10-18 22:21:38.757597     10.0.0.4 -> 10.0.0.1     TCP 66 targus-getdata1 > 38324 [ACK] Seq=1 Ack=30446 Win=90112 Len=0 TSval=121975449 TSecr=121975423
 67 2016-10-18 22:21:38.758802     10.0.0.1 -> 10.0.0.4     TCP 1514 38324 > targus-getdata1 [PSH, ACK] Seq=30446 Ack=1 Win=29696 Len=1448 TSval=121975423 TSecr=121975403
 68 2016-10-18 22:21:38.758869     10.0.0.4 -> 10.0.0.1     TCP 66 targus-getdata1 > 38324 [ACK] Seq=1 Ack=31894 Win=92672 Len=0 TSval=121975451 TSecr=121975423
 69 2016-10-18 22:21:38.759912     10.0.0.1 -> 10.0.0.4     TCP 1514 38324 > targus-getdata1 [ACK] Seq=31894 Ack=1 Win=29696 Len=1448 TSval=121975424 TSecr=121975404
 70 2016-10-18 22:21:38.759952     10.0.0.4 -> 10.0.0.1     TCP 66 targus-getdata1 > 38324 [ACK] Seq=1 Ack=33342 Win=95744 Len=0 TSval=121975452 TSecr=121975424
 71 2016-10-18 22:21:38.761143     10.0.0.1 -> 10.0.0.4     TCP 1514 38324 > targus-getdata1 [ACK] Seq=33342 Ack=1 Win=29696 Len=1448 TSval=121975424 TSecr=121975404
 72 2016-10-18 22:21:38.761185     10.0.0.4 -> 10.0.0.1     TCP 66 targus-getdata1 > 38324 [ACK] Seq=1 Ack=34790 Win=98816 Len=0 TSval=121975453 TSecr=121975424
 73 2016-10-18 22:21:38.762397     10.0.0.1 -> 10.0.0.4     TCP 1514 38324 > targus-getdata1 [ACK] Seq=34790 Ack=1 Win=29696 Len=1448 TSval=121975425 TSecr=121975405
 74 2016-10-18 22:21:38.762446     10.0.0.4 -> 10.0.0.1     TCP 66 targus-getdata1 > 38324 [ACK] Seq=1 Ack=36238 Win=101376 Len=0 TSval=121975454 TSecr=121975425
 75 2016-10-18 22:21:38.763610     10.0.0.1 -> 10.0.0.4     TCP 1514 38324 > targus-getdata1 [ACK] Seq=36238 Ack=1 Win=29696 Len=1448 TSval=121975425 TSecr=121975405
 76 2016-10-18 22:21:38.763672     10.0.0.4 -> 10.0.0.1     TCP 66 targus-getdata1 > 38324 [ACK] Seq=1 Ack=37686 Win=104448 Len=0 TSval=121975456 TSecr=121975425
 77 2016-10-18 22:21:38.764820     10.0.0.1 -> 10.0.0.4     TCP 1514 38324 > targus-getdata1 [ACK] Seq=37686 Ack=1 Win=29696 Len=1448 TSval=121975427 TSecr=121975406
 78 2016-10-18 22:21:38.764865     10.0.0.4 -> 10.0.0.1     TCP 66 targus-getdata1 > 38324 [ACK] Seq=1 Ack=39134 Win=107520 Len=0 TSval=121975457 TSecr=121975427
 79 2016-10-18 22:21:38.765967     10.0.0.1 -> 10.0.0.4     TCP 1514 38324 > targus-getdata1 [ACK] Seq=39134 Ack=1 Win=29696 Len=1448 TSval=121975427 TSecr=121975406
 80 2016-10-18 22:21:38.766010     10.0.0.4 -> 10.0.0.1     TCP 66 targus-getdata1 > 38324 [ACK] Seq=1 Ack=40582 Win=110080 Len=0 TSval=121975458 TSecr=121975427
 81 2016-10-18 22:21:38.767199     10.0.0.1 -> 10.0.0.4     TCP 1514 38324 > targus-getdata1 [ACK] Seq=40582 Ack=1 Win=29696 Len=1448 TSval=121975428 TSecr=121975408
 82 2016-10-18 22:21:38.767235     10.0.0.4 -> 10.0.0.1     TCP 66 targus-getdata1 > 38324 [ACK] Seq=1 Ack=42030 Win=113152 Len=0 TSval=121975459 TSecr=121975428
 83 2016-10-18 22:21:38.768378     10.0.0.1 -> 10.0.0.4     TCP 1514 38324 > targus-getdata1 [ACK] Seq=42030 Ack=1 Win=29696 Len=1448 TSval=121975428 TSecr=121975408
 84 2016-10-18 22:21:38.768418     10.0.0.4 -> 10.0.0.1     TCP 66 targus-getdata1 > 38324 [ACK] Seq=1 Ack=43478 Win=116224 Len=0 TSval=121975460 TSecr=121975428
 85 2016-10-18 22:21:38.787520     10.0.0.1 -> 10.0.0.4     TCP 1514 38324 > targus-getdata1 [ACK] Seq=43478 Ack=1 Win=29696 Len=1448 TSval=121975459 TSecr=121975439
 86 2016-10-18 22:21:38.787550     10.0.0.4 -> 10.0.0.1     TCP 66 targus-getdata1 > 38324 [ACK] Seq=1 Ack=44926 Win=118784 Len=0 TSval=121975479 TSecr=121975459
 87 2016-10-18 22:21:38.787571     10.0.0.1 -> 10.0.0.4     TCP 1514 38324 > targus-getdata1 [ACK] Seq=44926 Ack=1 Win=29696 Len=1448 TSval=121975459 TSecr=121975439
 88 2016-10-18 22:21:38.787604     10.0.0.4 -> 10.0.0.1     TCP 66 targus-getdata1 > 38324 [ACK] Seq=1 Ack=46374 Win=121856 Len=0 TSval=121975479 TSecr=121975459
 89 2016-10-18 22:21:38.788700     10.0.0.1 -> 10.0.0.4     TCP 1514 38324 > targus-getdata1 [PSH, ACK] Seq=46374 Ack=1 Win=29696 Len=1448 TSval=121975459 TSecr=121975439
 90 2016-10-18 22:21:38.788733     10.0.0.4 -> 10.0.0.1     TCP 66 targus-getdata1 > 38324 [ACK] Seq=1 Ack=47822 Win=124928 Len=0 TSval=121975481 TSecr=121975459
 91 2016-10-18 22:21:38.789768     10.0.0.1 -> 10.0.0.4     TCP 1514 38324 > targus-getdata1 [ACK] Seq=47822 Ack=1 Win=29696 Len=1448 TSval=121975459 TSecr=121975439
 92 2016-10-18 22:21:38.789810     10.0.0.4 -> 10.0.0.1     TCP 66 targus-getdata1 > 38324 [ACK] Seq=1 Ack=49270 Win=127488 Len=0 TSval=121975482 TSecr=121975459
 93 2016-10-18 22:21:38.790931     10.0.0.1 -> 10.0.0.4     TCP 1514 38324 > targus-getdata1 [ACK] Seq=49270 Ack=1 Win=29696 Len=1448 TSval=121975460 TSecr=121975440
 94 2016-10-18 22:21:38.790971     10.0.0.4 -> 10.0.0.1     TCP 66 targus-getdata1 > 38324 [ACK] Seq=1 Ack=50718 Win=130560 Len=0 TSval=121975483 TSecr=121975460
 95 2016-10-18 22:21:38.792140     10.0.0.1 -> 10.0.0.4     TCP 1514 38324 > targus-getdata1 [ACK] Seq=50718 Ack=1 Win=29696 Len=1448 TSval=121975460 TSecr=121975440
 96 2016-10-18 22:21:38.792173     10.0.0.4 -> 10.0.0.1     TCP 66 targus-getdata1 > 38324 [ACK] Seq=1 Ack=52166 Win=133632 Len=0 TSval=121975484 TSecr=121975460
 97 2016-10-18 22:21:38.793399     10.0.0.1 -> 10.0.0.4     TCP 1514 38324 > targus-getdata1 [ACK] Seq=52166 Ack=1 Win=29696 Len=1448 TSval=121975461 TSecr=121975441
 98 2016-10-18 22:21:38.793445     10.0.0.4 -> 10.0.0.1     TCP 66 targus-getdata1 > 38324 [ACK] Seq=1 Ack=53614 Win=136192 Len=0 TSval=121975485 TSecr=121975461
 99 2016-10-18 22:21:38.794565     10.0.0.1 -> 10.0.0.4     TCP 1514 38324 > targus-getdata1 [ACK] Seq=53614 Ack=1 Win=29696 Len=1448 TSval=121975461 TSecr=121975441
100 2016-10-18 22:21:38.794650     10.0.0.4 -> 10.0.0.1     TCP 66 targus-getdata1 > 38324 [ACK] Seq=1 Ack=55062 Win=139264 Len=0 TSval=121975486 TSecr=121975461
101 2016-10-18 22:21:38.795823     10.0.0.1 -> 10.0.0.4     TCP 1514 38324 > targus-getdata1 [ACK] Seq=55062 Ack=1 Win=29696 Len=1448 TSval=121975462 TSecr=121975442
102 2016-10-18 22:21:38.795872     10.0.0.4 -> 10.0.0.1     TCP 66 targus-getdata1 > 38324 [ACK] Seq=1 Ack=56510 Win=142336 Len=0 TSval=121975488 TSecr=121975462
103 2016-10-18 22:21:38.797008     10.0.0.1 -> 10.0.0.4     TCP 1514 38324 > targus-getdata1 [PSH, ACK] Seq=56510 Ack=1 Win=29696 Len=1448 TSval=121975462 TSecr=121975442
104 2016-10-18 22:21:38.797054     10.0.0.4 -> 10.0.0.1     TCP 66 targus-getdata1 > 38324 [ACK] Seq=1 Ack=57958 Win=144896 Len=0 TSval=121975489 TSecr=121975462
105 2016-10-18 22:21:38.798271     10.0.0.1 -> 10.0.0.4     TCP 1514 38324 > targus-getdata1 [ACK] Seq=57958 Ack=1 Win=29696 Len=1448 TSval=121975464 TSecr=121975443
106 2016-10-18 22:21:38.798326     10.0.0.4 -> 10.0.0.1     TCP 66 targus-getdata1 > 38324 [ACK] Seq=1 Ack=59406 Win=147968 Len=0 TSval=121975490 TSecr=121975464
107 2016-10-18 22:21:38.799496     10.0.0.1 -> 10.0.0.4     TCP 1514 38324 > targus-getdata1 [ACK] Seq=59406 Ack=1 Win=29696 Len=1448 TSval=121975464 TSecr=121975443
108 2016-10-18 22:21:38.799551     10.0.0.4 -> 10.0.0.1     TCP 66 targus-getdata1 > 38324 [ACK] Seq=1 Ack=60854 Win=151040 Len=0 TSval=121975491 TSecr=121975464
109 2016-10-18 22:21:38.800730     10.0.0.1 -> 10.0.0.4     TCP 1514 38324 > targus-getdata1 [ACK] Seq=60854 Ack=1 Win=29696 Len=1448 TSval=121975465 TSecr=121975445
110 2016-10-18 22:21:38.800793     10.0.0.4 -> 10.0.0.1     TCP 66 targus-getdata1 > 38324 [ACK] Seq=1 Ack=62302 Win=153600 Len=0 TSval=121975493 TSecr=121975465
111 2016-10-18 22:21:38.801842     10.0.0.1 -> 10.0.0.4     TCP 1514 38324 > targus-getdata1 [ACK] Seq=62302 Ack=1 Win=29696 Len=1448 TSval=121975465 TSecr=121975445
112 2016-10-18 22:21:38.801895     10.0.0.4 -> 10.0.0.1     TCP 66 targus-getdata1 > 38324 [ACK] Seq=1 Ack=63750 Win=156672 Len=0 TSval=121975494 TSecr=121975465
113 2016-10-18 22:21:38.803090     10.0.0.1 -> 10.0.0.4     TCP 1514 38324 > targus-getdata1 [ACK] Seq=63750 Ack=1 Win=29696 Len=1448 TSval=121975466 TSecr=121975446
114 2016-10-18 22:21:38.803145     10.0.0.4 -> 10.0.0.1     TCP 66 targus-getdata1 > 38324 [ACK] Seq=1 Ack=65198 Win=159744 Len=0 TSval=121975495 TSecr=121975466
115 2016-10-18 22:21:38.804329     10.0.0.1 -> 10.0.0.4     TCP 1514 38324 > targus-getdata1 [ACK] Seq=65198 Ack=1 Win=29696 Len=1448 TSval=121975466 TSecr=121975446
116 2016-10-18 22:21:38.804383     10.0.0.4 -> 10.0.0.1     TCP 66 targus-getdata1 > 38324 [ACK] Seq=1 Ack=66646 Win=162304 Len=0 TSval=121975496 TSecr=121975466
117 2016-10-18 22:21:38.805510     10.0.0.1 -> 10.0.0.4     TCP 1514 38324 > targus-getdata1 [ACK] Seq=66646 Ack=1 Win=29696 Len=1448 TSval=121975467 TSecr=121975447
118 2016-10-18 22:21:38.805548     10.0.0.4 -> 10.0.0.1     TCP 66 targus-getdata1 > 38324 [ACK] Seq=1 Ack=68094 Win=165376 Len=0 TSval=121975497 TSecr=121975467
119 2016-10-18 22:21:38.806776     10.0.0.1 -> 10.0.0.4     TCP 1514 38324 > targus-getdata1 [ACK] Seq=68094 Ack=1 Win=29696 Len=1448 TSval=121975467 TSecr=121975447
120 2016-10-18 22:21:38.806853     10.0.0.4 -> 10.0.0.1     TCP 66 targus-getdata1 > 38324 [ACK] Seq=1 Ack=69542 Win=168448 Len=0 TSval=121975499 TSecr=121975467
121 2016-10-18 22:21:38.808133     10.0.0.1 -> 10.0.0.4     TCP 1514 38324 > targus-getdata1 [ACK] Seq=69542 Ack=1 Win=29696 Len=1448 TSval=121975468 TSecr=121975448
122 2016-10-18 22:21:38.808186     10.0.0.4 -> 10.0.0.1     TCP 66 targus-getdata1 > 38324 [ACK] Seq=1 Ack=70990 Win=171008 Len=0 TSval=121975500 TSecr=121975468
123 2016-10-18 22:21:38.809081     10.0.0.1 -> 10.0.0.4     TCP 1514 38324 > targus-getdata1 [ACK] Seq=70990 Ack=1 Win=29696 Len=1448 TSval=121975468 TSecr=121975448
124 2016-10-18 22:21:38.809134     10.0.0.4 -> 10.0.0.1     TCP 66 targus-getdata1 > 38324 [ACK] Seq=1 Ack=72438 Win=174080 Len=0 TSval=121975501 TSecr=121975468
125 2016-10-18 22:21:38.810472     10.0.0.1 -> 10.0.0.4     TCP 1514 38324 > targus-getdata1 [ACK] Seq=72438 Ack=1 Win=29696 Len=1448 TSval=121975470 TSecr=121975449
126 2016-10-18 22:21:38.810516     10.0.0.4 -> 10.0.0.1     TCP 66 targus-getdata1 > 38324 [ACK] Seq=1 Ack=73886 Win=177152 Len=0 TSval=121975502 TSecr=121975470
127 2016-10-18 22:21:38.811510     10.0.0.1 -> 10.0.0.4     TCP 1514 38324 > targus-getdata1 [ACK] Seq=73886 Ack=1 Win=29696 Len=1448 TSval=121975470 TSecr=121975449
128 2016-10-18 22:21:38.811547     10.0.0.4 -> 10.0.0.1     TCP 66 targus-getdata1 > 38324 [ACK] Seq=1 Ack=75334 Win=179712 Len=0 TSval=121975503 TSecr=121975470
129 2016-10-18 22:21:38.812726     10.0.0.1 -> 10.0.0.4     TCP 1514 38324 > targus-getdata1 [ACK] Seq=75334 Ack=1 Win=29696 Len=1448 TSval=121975471 TSecr=121975451
130 2016-10-18 22:21:38.812764     10.0.0.4 -> 10.0.0.1     TCP 66 targus-getdata1 > 38324 [ACK] Seq=1 Ack=76782 Win=182784 Len=0 TSval=121975505 TSecr=121975471
131 2016-10-18 22:21:38.813955     10.0.0.1 -> 10.0.0.4     TCP 1514 38324 > targus-getdata1 [PSH, ACK] Seq=76782 Ack=1 Win=29696 Len=1448 TSval=121975471 TSecr=121975451
132 2016-10-18 22:21:38.814004     10.0.0.4 -> 10.0.0.1     TCP 66 targus-getdata1 > 38324 [ACK] Seq=1 Ack=78230 Win=185344 Len=0 TSval=121975506 TSecr=121975471
133 2016-10-18 22:21:38.815125     10.0.0.1 -> 10.0.0.4     TCP 1514 38324 > targus-getdata1 [ACK] Seq=78230 Ack=1 Win=29696 Len=1448 TSval=121975472 TSecr=121975452
134 2016-10-18 22:21:38.815163     10.0.0.4 -> 10.0.0.1     TCP 66 targus-getdata1 > 38324 [ACK] Seq=1 Ack=79678 Win=188416 Len=0 TSval=121975507 TSecr=121975472
135 2016-10-18 22:21:38.816362     10.0.0.1 -> 10.0.0.4     TCP 1514 38324 > targus-getdata1 [ACK] Seq=79678 Ack=1 Win=29696 Len=1448 TSval=121975472 TSecr=121975452
136 2016-10-18 22:21:38.816400     10.0.0.4 -> 10.0.0.1     TCP 66 targus-getdata1 > 38324 [ACK] Seq=1 Ack=81126 Win=191488 Len=0 TSval=121975508 TSecr=121975472
137 2016-10-18 22:21:38.817548     10.0.0.1 -> 10.0.0.4     TCP 1514 38324 > targus-getdata1 [ACK] Seq=81126 Ack=1 Win=29696 Len=1448 TSval=121975473 TSecr=121975453
138 2016-10-18 22:21:38.817586     10.0.0.4 -> 10.0.0.1     TCP 66 targus-getdata1 > 38324 [ACK] Seq=1 Ack=82574 Win=194048 Len=0 TSval=121975509 TSecr=121975473
139 2016-10-18 22:21:38.818748     10.0.0.1 -> 10.0.0.4     TCP 1514 38324 > targus-getdata1 [ACK] Seq=82574 Ack=1 Win=29696 Len=1448 TSval=121975473 TSecr=121975453
140 2016-10-18 22:21:38.818798     10.0.0.4 -> 10.0.0.1     TCP 66 targus-getdata1 > 38324 [ACK] Seq=1 Ack=84022 Win=197120 Len=0 TSval=121975511 TSecr=121975473
141 2016-10-18 22:21:38.819995     10.0.0.1 -> 10.0.0.4     TCP 1514 38324 > targus-getdata1 [ACK] Seq=84022 Ack=1 Win=29696 Len=1448 TSval=121975475 TSecr=121975454
142 2016-10-18 22:21:38.820029     10.0.0.4 -> 10.0.0.1     TCP 66 targus-getdata1 > 38324 [ACK] Seq=1 Ack=85470 Win=200192 Len=0 TSval=121975512 TSecr=121975475
143 2016-10-18 22:21:38.821180     10.0.0.1 -> 10.0.0.4     TCP 1514 38324 > targus-getdata1 [ACK] Seq=85470 Ack=1 Win=29696 Len=1448 TSval=121975475 TSecr=121975454
144 2016-10-18 22:21:38.821216     10.0.0.4 -> 10.0.0.1     TCP 66 targus-getdata1 > 38324 [ACK] Seq=1 Ack=86918 Win=202752 Len=0 TSval=121975513 TSecr=121975475
145 2016-10-18 22:21:38.822392     10.0.0.1 -> 10.0.0.4     TCP 1514 38324 > targus-getdata1 [ACK] Seq=86918 Ack=1 Win=29696 Len=1448 TSval=121975476 TSecr=121975456
146 2016-10-18 22:21:38.822432     10.0.0.4 -> 10.0.0.1     TCP 66 targus-getdata1 > 38324 [ACK] Seq=1 Ack=88366 Win=205824 Len=0 TSval=121975514 TSecr=121975476
147 2016-10-18 22:21:38.823670     10.0.0.1 -> 10.0.0.4     TCP 1514 38324 > targus-getdata1 [ACK] Seq=88366 Ack=1 Win=29696 Len=1448 TSval=121975476 TSecr=121975456
148 2016-10-18 22:21:38.823733     10.0.0.4 -> 10.0.0.1     TCP 66 targus-getdata1 > 38324 [ACK] Seq=1 Ack=89814 Win=208896 Len=0 TSval=121975516 TSecr=121975476
149 2016-10-18 22:21:38.824831     10.0.0.1 -> 10.0.0.4     TCP 1514 38324 > targus-getdata1 [ACK] Seq=89814 Ack=1 Win=29696 Len=1448 TSval=121975477 TSecr=121975457
150 2016-10-18 22:21:38.824873     10.0.0.4 -> 10.0.0.1     TCP 66 targus-getdata1 > 38324 [ACK] Seq=1 Ack=91262 Win=211456 Len=0 TSval=121975517 TSecr=121975477
151 2016-10-18 22:21:38.826011     10.0.0.1 -> 10.0.0.4     TCP 1514 38324 > targus-getdata1 [ACK] Seq=91262 Ack=1 Win=29696 Len=1448 TSval=121975477 TSecr=121975457
152 2016-10-18 22:21:38.826048     10.0.0.4 -> 10.0.0.1     TCP 66 targus-getdata1 > 38324 [ACK] Seq=1 Ack=92710 Win=214528 Len=0 TSval=121975518 TSecr=121975477
153 2016-10-18 22:21:38.827218     10.0.0.1 -> 10.0.0.4     TCP 1514 38324 > targus-getdata1 [ACK] Seq=92710 Ack=1 Win=29696 Len=1448 TSval=121975478 TSecr=121975458
154 2016-10-18 22:21:38.827255     10.0.0.4 -> 10.0.0.1     TCP 66 targus-getdata1 > 38324 [ACK] Seq=1 Ack=94158 Win=217600 Len=0 TSval=121975519 TSecr=121975478
155 2016-10-18 22:21:38.828519     10.0.0.1 -> 10.0.0.4     TCP 1514 38324 > targus-getdata1 [ACK] Seq=94158 Ack=1 Win=29696 Len=1448 TSval=121975478 TSecr=121975458
156 2016-10-18 22:21:38.828565     10.0.0.4 -> 10.0.0.1     TCP 66 targus-getdata1 > 38324 [ACK] Seq=1 Ack=95606 Win=220160 Len=0 TSval=121975520 TSecr=121975478
157 2016-10-18 22:21:38.829684     10.0.0.1 -> 10.0.0.4     TCP 1514 38324 > targus-getdata1 [ACK] Seq=95606 Ack=1 Win=29696 Len=1448 TSval=121975479 TSecr=121975459
158 2016-10-18 22:21:38.829735     10.0.0.4 -> 10.0.0.1     TCP 66 targus-getdata1 > 38324 [ACK] Seq=1 Ack=97054 Win=223232 Len=0 TSval=121975522 TSecr=121975479
159 2016-10-18 22:21:38.830917     10.0.0.1 -> 10.0.0.4     TCP 1514 38324 > targus-getdata1 [ACK] Seq=97054 Ack=1 Win=29696 Len=1448 TSval=121975479 TSecr=121975459
160 2016-10-18 22:21:38.830953     10.0.0.4 -> 10.0.0.1     TCP 66 targus-getdata1 > 38324 [ACK] Seq=1 Ack=98502 Win=226304 Len=0 TSval=121975523 TSecr=121975479
161 2016-10-18 22:21:38.832079     10.0.0.1 -> 10.0.0.4     TCP 1514 38324 > targus-getdata1 [ACK] Seq=98502 Ack=1 Win=29696 Len=1448 TSval=121975480 TSecr=121975460
162 2016-10-18 22:21:38.832119     10.0.0.4 -> 10.0.0.1     TCP 66 targus-getdata1 > 38324 [ACK] Seq=1 Ack=99950 Win=228864 Len=0 TSval=121975524 TSecr=121975480
163 2016-10-18 22:21:38.833310     10.0.0.1 -> 10.0.0.4     TCP 1514 38324 > targus-getdata1 [ACK] Seq=99950 Ack=1 Win=29696 Len=1448 TSval=121975480 TSecr=121975460
164 2016-10-18 22:21:38.833349     10.0.0.4 -> 10.0.0.1     TCP 66 targus-getdata1 > 38324 [ACK] Seq=1 Ack=101398 Win=231936 Len=0 TSval=121975525 TSecr=121975480
165 2016-10-18 22:21:38.834502     10.0.0.1 -> 10.0.0.4     TCP 1514 38324 > targus-getdata1 [ACK] Seq=101398 Ack=1 Win=29696 Len=1448 TSval=121975500 TSecr=121975479
166 2016-10-18 22:21:38.834544     10.0.0.4 -> 10.0.0.1     TCP 66 targus-getdata1 > 38324 [ACK] Seq=1 Ack=102846 Win=235008 Len=0 TSval=121975526 TSecr=121975500
167 2016-10-18 22:21:38.835740     10.0.0.1 -> 10.0.0.4     TCP 1514 38324 > targus-getdata1 [ACK] Seq=102846 Ack=1 Win=29696 Len=1448 TSval=121975500 TSecr=121975479
168 2016-10-18 22:21:38.835771     10.0.0.4 -> 10.0.0.1     TCP 66 targus-getdata1 > 38324 [ACK] Seq=1 Ack=104294 Win=237568 Len=0 TSval=121975528 TSecr=121975500
169 2016-10-18 22:21:38.836924     10.0.0.1 -> 10.0.0.4     TCP 1514 38324 > targus-getdata1 [ACK] Seq=104294 Ack=1 Win=29696 Len=1448 TSval=121975500 TSecr=121975479
170 2016-10-18 22:21:38.836960     10.0.0.4 -> 10.0.0.1     TCP 66 targus-getdata1 > 38324 [ACK] Seq=1 Ack=105742 Win=240640 Len=0 TSval=121975529 TSecr=121975500
171 2016-10-18 22:21:38.838163     10.0.0.1 -> 10.0.0.4     TCP 1514 38324 > targus-getdata1 [ACK] Seq=105742 Ack=1 Win=29696 Len=1448 TSval=121975500 TSecr=121975479
172 2016-10-18 22:21:38.838196     10.0.0.4 -> 10.0.0.1     TCP 66 targus-getdata1 > 38324 [ACK] Seq=1 Ack=107190 Win=243712 Len=0 TSval=121975530 TSecr=121975500
173 2016-10-18 22:21:38.839358     10.0.0.1 -> 10.0.0.4     TCP 1514 38324 > targus-getdata1 [ACK] Seq=107190 Ack=1 Win=29696 Len=1448 TSval=121975501 TSecr=121975481
174 2016-10-18 22:21:38.839398     10.0.0.4 -> 10.0.0.1     TCP 66 targus-getdata1 > 38324 [ACK] Seq=1 Ack=108638 Win=246272 Len=0 TSval=121975531 TSecr=121975501
175 2016-10-18 22:21:38.840569     10.0.0.1 -> 10.0.0.4     TCP 1514 38324 > targus-getdata1 [ACK] Seq=108638 Ack=1 Win=29696 Len=1448 TSval=121975501 TSecr=121975481
176 2016-10-18 22:21:38.840610     10.0.0.4 -> 10.0.0.1     TCP 66 targus-getdata1 > 38324 [ACK] Seq=1 Ack=110086 Win=249344 Len=0 TSval=121975532 TSecr=121975501
177 2016-10-18 22:21:38.841773     10.0.0.1 -> 10.0.0.4     TCP 1514 38324 > targus-getdata1 [ACK] Seq=110086 Ack=1 Win=29696 Len=1448 TSval=121975502 TSecr=121975482
178 2016-10-18 22:21:38.841810     10.0.0.4 -> 10.0.0.1     TCP 66 targus-getdata1 > 38324 [ACK] Seq=1 Ack=111534 Win=252416 Len=0 TSval=121975534 TSecr=121975502
179 2016-10-18 22:21:38.842992     10.0.0.1 -> 10.0.0.4     TCP 1514 38324 > targus-getdata1 [ACK] Seq=111534 Ack=1 Win=29696 Len=1448 TSval=121975502 TSecr=121975482
180 2016-10-18 22:21:38.843029     10.0.0.4 -> 10.0.0.1     TCP 66 targus-getdata1 > 38324 [ACK] Seq=1 Ack=112982 Win=254976 Len=0 TSval=121975535 TSecr=121975502
181 2016-10-18 22:21:38.844214     10.0.0.1 -> 10.0.0.4     TCP 1514 38324 > targus-getdata1 [ACK] Seq=112982 Ack=1 Win=29696 Len=1448 TSval=121975503 TSecr=121975483
182 2016-10-18 22:21:38.844256     10.0.0.4 -> 10.0.0.1     TCP 66 targus-getdata1 > 38324 [ACK] Seq=1 Ack=114430 Win=258048 Len=0 TSval=121975536 TSecr=121975503
183 2016-10-18 22:21:38.845416     10.0.0.1 -> 10.0.0.4     TCP 1514 38324 > targus-getdata1 [ACK] Seq=114430 Ack=1 Win=29696 Len=1448 TSval=121975503 TSecr=121975483
184 2016-10-18 22:21:38.845455     10.0.0.4 -> 10.0.0.1     TCP 66 targus-getdata1 > 38324 [ACK] Seq=1 Ack=115878 Win=261120 Len=0 TSval=121975537 TSecr=121975503
185 2016-10-18 22:21:38.846651     10.0.0.1 -> 10.0.0.4     TCP 1514 38324 > targus-getdata1 [ACK] Seq=115878 Ack=1 Win=29696 Len=1448 TSval=121975504 TSecr=121975484
186 2016-10-18 22:21:38.846711     10.0.0.4 -> 10.0.0.1     TCP 66 targus-getdata1 > 38324 [ACK] Seq=1 Ack=117326 Win=263680 Len=0 TSval=121975539 TSecr=121975504
187 2016-10-18 22:21:38.847835     10.0.0.1 -> 10.0.0.4     TCP 1514 38324 > targus-getdata1 [ACK] Seq=117326 Ack=1 Win=29696 Len=1448 TSval=121975504 TSecr=121975484
188 2016-10-18 22:21:38.847882     10.0.0.4 -> 10.0.0.1     TCP 66 targus-getdata1 > 38324 [ACK] Seq=1 Ack=118774 Win=266752 Len=0 TSval=121975540 TSecr=121975504
189 2016-10-18 22:21:38.849108     10.0.0.1 -> 10.0.0.4     TCP 1514 38324 > targus-getdata1 [ACK] Seq=118774 Ack=1 Win=29696 Len=1448 TSval=121975505 TSecr=121975485
190 2016-10-18 22:21:38.849142     10.0.0.4 -> 10.0.0.1     TCP 66 targus-getdata1 > 38324 [ACK] Seq=1 Ack=120222 Win=269824 Len=0 TSval=121975541 TSecr=121975505
191 2016-10-18 22:21:38.850322     10.0.0.1 -> 10.0.0.4     TCP 1514 38324 > targus-getdata1 [ACK] Seq=120222 Ack=1 Win=29696 Len=1448 TSval=121975505 TSecr=121975485
192 2016-10-18 22:21:38.850356     10.0.0.4 -> 10.0.0.1     TCP 66 targus-getdata1 > 38324 [ACK] Seq=1 Ack=121670 Win=272384 Len=0 TSval=121975542 TSecr=121975505
193 2016-10-18 22:21:38.851580     10.0.0.1 -> 10.0.0.4     TCP 1514 38324 > targus-getdata1 [ACK] Seq=121670 Ack=1 Win=29696 Len=1448 TSval=121975507 TSecr=121975486
194 2016-10-18 22:21:38.851614     10.0.0.4 -> 10.0.0.1     TCP 66 targus-getdata1 > 38324 [ACK] Seq=1 Ack=123118 Win=275456 Len=0 TSval=121975543 TSecr=121975507
195 2016-10-18 22:21:38.852750     10.0.0.1 -> 10.0.0.4     TCP 1514 38324 > targus-getdata1 [ACK] Seq=123118 Ack=1 Win=29696 Len=1448 TSval=121975507 TSecr=121975486
196 2016-10-18 22:21:38.852783     10.0.0.4 -> 10.0.0.1     TCP 66 targus-getdata1 > 38324 [ACK] Seq=1 Ack=124566 Win=278016 Len=0 TSval=121975545 TSecr=121975507
197 2016-10-18 22:21:38.854038     10.0.0.1 -> 10.0.0.4     TCP 1514 38324 > targus-getdata1 [ACK] Seq=124566 Ack=1 Win=29696 Len=1448 TSval=121975508 TSecr=121975488
198 2016-10-18 22:21:38.854082     10.0.0.4 -> 10.0.0.1     TCP 66 targus-getdata1 > 38324 [ACK] Seq=1 Ack=126014 Win=281088 Len=0 TSval=121975546 TSecr=121975508
199 2016-10-18 22:21:38.855189     10.0.0.1 -> 10.0.0.4     TCP 1514 38324 > targus-getdata1 [PSH, ACK] Seq=126014 Ack=1 Win=29696 Len=1448 TSval=121975508 TSecr=121975488
200 2016-10-18 22:21:38.855228     10.0.0.4 -> 10.0.0.1     TCP 66 targus-getdata1 > 38324 [ACK] Seq=1 Ack=127462 Win=284160 Len=0 TSval=121975547 TSecr=121975508
201 2016-10-18 22:21:38.856352     10.0.0.1 -> 10.0.0.4     TCP 1514 38324 > targus-getdata1 [PSH, ACK] Seq=127462 Ack=1 Win=29696 Len=1448 TSval=121975509 TSecr=121975489
202 2016-10-18 22:21:38.856382     10.0.0.4 -> 10.0.0.1     TCP 66 targus-getdata1 > 38324 [ACK] Seq=1 Ack=128910 Win=286720 Len=0 TSval=121975548 TSecr=121975509
203 2016-10-18 22:21:38.857549     10.0.0.1 -> 10.0.0.4     TCP 1514 38324 > targus-getdata1 [ACK] Seq=128910 Ack=1 Win=29696 Len=1448 TSval=121975509 TSecr=121975489
204 2016-10-18 22:21:38.857600     10.0.0.4 -> 10.0.0.1     TCP 66 targus-getdata1 > 38324 [ACK] Seq=1 Ack=130358 Win=289792 Len=0 TSval=121975549 TSecr=121975509
205 2016-10-18 22:21:38.858844     10.0.0.1 -> 10.0.0.4     TCP 1514 38324 > targus-getdata1 [ACK] Seq=130358 Ack=1 Win=29696 Len=1448 TSval=121975510 TSecr=121975490
206 2016-10-18 22:21:38.858883     10.0.0.4 -> 10.0.0.1     TCP 66 targus-getdata1 > 38324 [ACK] Seq=1 Ack=131806 Win=292864 Len=0 TSval=121975551 TSecr=121975510
207 2016-10-18 22:21:38.860022     10.0.0.1 -> 10.0.0.4     TCP 1514 38324 > targus-getdata1 [ACK] Seq=131806 Ack=1 Win=29696 Len=1448 TSval=121975510 TSecr=121975490
208 2016-10-18 22:21:38.860055     10.0.0.4 -> 10.0.0.1     TCP 66 targus-getdata1 > 38324 [ACK] Seq=1 Ack=133254 Win=295424 Len=0 TSval=121975552 TSecr=121975510
209 2016-10-18 22:21:38.861225     10.0.0.1 -> 10.0.0.4     TCP 1514 38324 > targus-getdata1 [ACK] Seq=133254 Ack=1 Win=29696 Len=1448 TSval=121975512 TSecr=121975491
210 2016-10-18 22:21:38.861255     10.0.0.4 -> 10.0.0.1     TCP 66 targus-getdata1 > 38324 [ACK] Seq=1 Ack=134702 Win=298496 Len=0 TSval=121975553 TSecr=121975512
211 2016-10-18 22:21:38.862385     10.0.0.1 -> 10.0.0.4     TCP 1514 38324 > targus-getdata1 [ACK] Seq=134702 Ack=1 Win=29696 Len=1448 TSval=121975512 TSecr=121975491
212 2016-10-18 22:21:38.862423     10.0.0.4 -> 10.0.0.1     TCP 66 targus-getdata1 > 38324 [ACK] Seq=1 Ack=136150 Win=301568 Len=0 TSval=121975554 TSecr=121975512
213 2016-10-18 22:21:38.863616     10.0.0.1 -> 10.0.0.4     TCP 1514 38324 > targus-getdata1 [ACK] Seq=136150 Ack=1 Win=29696 Len=1448 TSval=121975513 TSecr=121975493
214 2016-10-18 22:21:38.863671     10.0.0.4 -> 10.0.0.1     TCP 66 targus-getdata1 > 38324 [ACK] Seq=1 Ack=137598 Win=304128 Len=0 TSval=121975556 TSecr=121975513
215 2016-10-18 22:21:38.864944     10.0.0.1 -> 10.0.0.4     TCP 1514 38324 > targus-getdata1 [ACK] Seq=137598 Ack=1 Win=29696 Len=1448 TSval=121975513 TSecr=121975493
216 2016-10-18 22:21:38.864976     10.0.0.4 -> 10.0.0.1     TCP 66 targus-getdata1 > 38324 [ACK] Seq=1 Ack=139046 Win=307200 Len=0 TSval=121975557 TSecr=121975513
217 2016-10-18 22:21:38.866099     10.0.0.1 -> 10.0.0.4     TCP 1514 38324 > targus-getdata1 [ACK] Seq=139046 Ack=1 Win=29696 Len=1448 TSval=121975514 TSecr=121975494
218 2016-10-18 22:21:38.866124     10.0.0.4 -> 10.0.0.1     TCP 66 targus-getdata1 > 38324 [ACK] Seq=1 Ack=140494 Win=310272 Len=0 TSval=121975558 TSecr=121975514
219 2016-10-18 22:21:38.867272     10.0.0.1 -> 10.0.0.4     TCP 1514 38324 > targus-getdata1 [ACK] Seq=140494 Ack=1 Win=29696 Len=1448 TSval=121975514 TSecr=121975494
220 2016-10-18 22:21:38.867304     10.0.0.4 -> 10.0.0.1     TCP 66 targus-getdata1 > 38324 [ACK] Seq=1 Ack=141942 Win=312832 Len=0 TSval=121975559 TSecr=121975514
221 2016-10-18 22:21:38.868491     10.0.0.1 -> 10.0.0.4     TCP 1514 38324 > targus-getdata1 [ACK] Seq=141942 Ack=1 Win=29696 Len=1448 TSval=121975515 TSecr=121975495
222 2016-10-18 22:21:38.868522     10.0.0.4 -> 10.0.0.1     TCP 66 targus-getdata1 > 38324 [ACK] Seq=1 Ack=143390 Win=315904 Len=0 TSval=121975560 TSecr=121975515
223 2016-10-18 22:21:38.869803     10.0.0.1 -> 10.0.0.4     TCP 1514 38324 > targus-getdata1 [ACK] Seq=143390 Ack=1 Win=29696 Len=1448 TSval=121975515 TSecr=121975495
224 2016-10-18 22:21:38.869839     10.0.0.4 -> 10.0.0.1     TCP 66 targus-getdata1 > 38324 [ACK] Seq=1 Ack=144838 Win=318976 Len=0 TSval=121975562 TSecr=121975515
225 2016-10-18 22:21:38.870974     10.0.0.1 -> 10.0.0.4     TCP 1514 38324 > targus-getdata1 [ACK] Seq=144838 Ack=1 Win=29696 Len=1448 TSval=121975516 TSecr=121975496
226 2016-10-18 22:21:38.871011     10.0.0.4 -> 10.0.0.1     TCP 66 targus-getdata1 > 38324 [ACK] Seq=1 Ack=146286 Win=321536 Len=0 TSval=121975563 TSecr=121975516
227 2016-10-18 22:21:38.872240     10.0.0.1 -> 10.0.0.4     TCP 1514 38324 > targus-getdata1 [ACK] Seq=146286 Ack=1 Win=29696 Len=1448 TSval=121975516 TSecr=121975496
228 2016-10-18 22:21:38.872277     10.0.0.4 -> 10.0.0.1     TCP 66 targus-getdata1 > 38324 [ACK] Seq=1 Ack=147734 Win=324608 Len=0 TSval=121975564 TSecr=121975516
229 2016-10-18 22:21:38.873318     10.0.0.1 -> 10.0.0.4     TCP 1514 38324 > targus-getdata1 [ACK] Seq=147734 Ack=1 Win=29696 Len=1448 TSval=121975518 TSecr=121975497
230 2016-10-18 22:21:38.873351     10.0.0.4 -> 10.0.0.1     TCP 66 targus-getdata1 > 38324 [ACK] Seq=1 Ack=149182 Win=327680 Len=0 TSval=121975565 TSecr=121975518
231 2016-10-18 22:21:38.874715     10.0.0.1 -> 10.0.0.4     TCP 1514 38324 > targus-getdata1 [ACK] Seq=149182 Ack=1 Win=29696 Len=1448 TSval=121975518 TSecr=121975497
232 2016-10-18 22:21:38.874754     10.0.0.4 -> 10.0.0.1     TCP 66 targus-getdata1 > 38324 [ACK] Seq=1 Ack=150630 Win=330240 Len=0 TSval=121975567 TSecr=121975518
233 2016-10-18 22:21:38.875876     10.0.0.1 -> 10.0.0.4     TCP 1514 38324 > targus-getdata1 [ACK] Seq=150630 Ack=1 Win=29696 Len=1448 TSval=121975519 TSecr=121975499
234 2016-10-18 22:21:38.875914     10.0.0.4 -> 10.0.0.1     TCP 66 targus-getdata1 > 38324 [ACK] Seq=1 Ack=152078 Win=333312 Len=0 TSval=121975568 TSecr=121975519
235 2016-10-18 22:21:38.877035     10.0.0.1 -> 10.0.0.4     TCP 1514 38324 > targus-getdata1 [ACK] Seq=152078 Ack=1 Win=29696 Len=1448 TSval=121975519 TSecr=121975499
236 2016-10-18 22:21:38.877073     10.0.0.4 -> 10.0.0.1     TCP 66 targus-getdata1 > 38324 [ACK] Seq=1 Ack=153526 Win=336384 Len=0 TSval=121975569 TSecr=121975519
237 2016-10-18 22:21:38.878193     10.0.0.1 -> 10.0.0.4     TCP 1514 38324 > targus-getdata1 [ACK] Seq=153526 Ack=1 Win=29696 Len=1448 TSval=121975520 TSecr=121975500
238 2016-10-18 22:21:38.878225     10.0.0.4 -> 10.0.0.1     TCP 66 targus-getdata1 > 38324 [ACK] Seq=1 Ack=154974 Win=338944 Len=0 TSval=121975570 TSecr=121975520
239 2016-10-18 22:21:38.879493     10.0.0.1 -> 10.0.0.4     TCP 1514 38324 > targus-getdata1 [ACK] Seq=154974 Ack=1 Win=29696 Len=1448 TSval=121975520 TSecr=121975500
240 2016-10-18 22:21:38.879537     10.0.0.4 -> 10.0.0.1     TCP 66 targus-getdata1 > 38324 [ACK] Seq=1 Ack=156422 Win=342016 Len=0 TSval=121975571 TSecr=121975520
241 2016-10-18 22:21:38.880706     10.0.0.1 -> 10.0.0.4     TCP 1514 38324 > targus-getdata1 [ACK] Seq=156422 Ack=1 Win=29696 Len=1448 TSval=121975521 TSecr=121975501
242 2016-10-18 22:21:38.880743     10.0.0.4 -> 10.0.0.1     TCP 66 targus-getdata1 > 38324 [ACK] Seq=1 Ack=157870 Win=345088 Len=0 TSval=121975573 TSecr=121975521
243 2016-10-18 22:21:38.881860     10.0.0.1 -> 10.0.0.4     TCP 1514 38324 > targus-getdata1 [ACK] Seq=157870 Ack=1 Win=29696 Len=1448 TSval=121975521 TSecr=121975501
